id,title,created_utc,body,comment_created_utc
v2ljky,Anyone wanna change my life and give me bitcoin 😂😂😂😂,2022-06-01T18:54:02.000+02:00,,
v2lliv,Earn Bitcoin by creating content - Starbackr’s Shooting Star Sunday,2022-06-01T18:56:24.000+02:00,,
v2lz0w,What would happen if Bitcoin switched to Proof of Stake?,2022-06-01T19:12:10.000+02:00,,
v2lzq5,,2022-06-01T19:13:00.000+02:00,,
v2mxjz,,2022-06-01T19:53:07.000+02:00,,
v2n4ux,oh boy!...,2022-06-01T20:01:18.000+02:00,,
v2ndou,No Financial Advisor Needed,2022-06-01T20:11:09.000+02:00,,
v2nn1x,Bitcoin ve Ethereum 2023 Fiyat Tahmini Geleceği Başarılı Uzman Tahminleri,2022-06-01T20:21:59.000+02:00,,
v2o6y0,Just #Bitcoin things 😴,2022-06-01T20:45:36.000+02:00,,
v2pq4m,Bitcoin Optech Newsletter #202,2022-06-01T21:52:52.000+02:00,,
v2pqrl,Next halfing,2022-06-01T21:53:38.000+02:00,,
v2q75f,Who wanna make more cash trading?,2022-06-01T22:13:07.000+02:00,,
v2qhfn,Authors of my textbook bought at the top,2022-06-01T22:24:49.000+02:00,,
v2qho0,,2022-06-01T22:25:05.000+02:00,,
v2rkh1,,2022-06-01T23:11:42.000+02:00,,
v2x66l,"Bitcoin runs in cycles, so after a bear always comes a bull.",2022-06-02T03:22:44.000+02:00,,
v2xenu,,2022-06-02T03:35:28.000+02:00,,
v31bhh,,2022-06-02T07:08:19.000+02:00,,
v31wzx,cryptocurrency is the most popular digital currency although it has no central authority controlling it but it has risen to prominence due to it daily increasing value in the world stock market. send a dm about cryptocurrency,2022-06-02T07:48:16.000+02:00,,
v3228f,Best mining container: Meta-luban LB BOX,2022-06-02T07:58:25.000+02:00,,
v32mlt,Why pay more withdrawal fees on every withdrawal of your USDT tokens. Coinremitter is introducing one of the most interesting functions called Gas Station.,2022-06-02T08:38:23.000+02:00,,
v32q77,Follow my Bitcoin future trade leading for your profit.,2022-06-02T08:45:48.000+02:00,,
v32tjk,,2022-06-02T08:52:55.000+02:00,,
v3352l,bitcoin miming machine,2022-06-02T09:15:40.000+02:00,,
v34nl4,,2022-06-02T11:06:57.000+02:00,,
v34vj9,Pretty simple and well worth owning some Bitcoin.,2022-06-02T11:23:27.000+02:00,,
v3525a,Bitcoin as the base layer of the internet,2022-06-02T11:37:37.000+02:00,,
v355dt,"This is what caused Bitcoin (BTC) recent drop below $30K, and why Bitcoin may struggle to break through the $32K barrier",2022-06-02T11:44:18.000+02:00,,
v35jt7,What percentage of DeFi is a Ponzi?,2022-06-02T12:12:12.000+02:00,,
v364dl,Register to learn more about Digital Nutmeg,2022-06-02T12:52:08.000+02:00,,
v3664h,Bitcoiners have been saying this for how long?,2022-06-02T12:55:25.000+02:00,,
v399z6,"I'll have your business setup here in Maldives, its one of the countries with lowest tax and with most cash generating business opportunities.",2022-06-02T15:47:52.000+02:00,,
v39wqz,Now i finally get 5 BTC. 3 will be stored in Defi (earn 10%). Other 2 will be stored in ledger for my kid. My goal is saving 10 BTC until 30 years old. (Im still 26) It is the only way to be a rich i guess..,2022-06-02T16:18:14.000+02:00,,
v3ac57,Fight BACK Club by 21ISM A fact finding documentary looking into the lives of real life Bitcoiners.We’re all victims of Central Bank inflationary monetary policy but some need a cookie and a safe space. Some people have other ideas. Some fight back!,2022-06-02T16:38:07.000+02:00,,
v3b5ss,"\"Mervyn King (former Governor of BOE) strong criticism of central banks: \"\"the King Cnut theory of inflation\"\"\"",2022-06-02T17:15:43.000+02:00,,
v3c0e3,Everybody complaining about crypto but then good projects are ignored,2022-06-02T17:54:21.000+02:00,,
v3ksph,I want a pizza…..it’s really tough time for me,2022-06-03T00:33:41.000+02:00,,
v3nq62,Do Kwon partying it up in Singapore with his collateralised Bitcoin,2022-06-03T03:05:03.000+02:00,,
v3qfti,You feel like making BTC 5x so I can but sum oxy,2022-06-03T05:36:36.000+02:00,,
v3sgwv,What Are Rug Pulls? Find Out Everything You Need To Know About The Rising Crypto Scam!,2022-06-03T07:41:23.000+02:00,,
v3vetw,"ईश्वर एक है, यह सीख देते हुए कबीर जी कहते है कि हिन्दू कहता है मेरा ईश्वर राम है और मुस्लिम कहता है मेरा ईश्वर अल्लाह है - इसी बात पर दोनों धर्म के लोग लड़ कर मर जाते है उसके बाद भी कोई सच नहीं जान पता है कि ईश्वर एक है। हिन्दू कहें मोहि राम पियारा, तुर्क कहें रहमान, आपस में दोउ लड़ी मुए, मरम न कोउ ज",2022-06-03T11:16:10.000+02:00,,
v3vwg2,Moving away from maximalism,2022-06-03T11:54:05.000+02:00,,
v3woww,"I stake most of my USDT in Natomi protocol, it is better to leave it as USDT or change it to USDC ?",2022-06-03T12:49:43.000+02:00,,
v3xisx,Bitcoin bounces to $30.7K as analyst presents Stock-to-Flow BTC price model rehash,2022-06-03T13:43:09.000+02:00,,
v3xus4,Gemini exchange sued over Bitcoin Futures Manipulation,2022-06-03T14:02:30.000+02:00,,
v3y1p0,That trading chart,2022-06-03T14:13:39.000+02:00,,
v3yahz,,2022-06-03T14:28:00.000+02:00,,
v3ylay,BITCOIN MEGA INVESTMENT!! MEGA PROMOTION!! INVEST $ 50 TO GET $ 1100 INVEST $ 100 TO GET $ 2200 INVEST $ 200 TO GET $3500 INVEST $300 TO GET $4500 INVEST $ 500 TO GET $6500 PROFIT IN 4 HOURS FIRST 22 INVESTORS ONLY.DM!!,2022-06-03T14:44:58.000+02:00,,
v3yv9p,PROFESSIONAL CREDIT REPAIRING SPECIALIST,2022-06-03T14:59:45.000+02:00,,
v3z1rt,Quantum Computing,2022-06-03T15:08:54.000+02:00,,
v3z8wb,Wild Turkey!! Link to NFT in comment,2022-06-03T15:19:31.000+02:00,,
v3zuur,Bitcoin Creator(s) out there watching everything,2022-06-03T15:50:42.000+02:00,,
v3zxwz,New York is now a step away from banning Bitcoin mining for two years,2022-06-03T15:55:00.000+02:00,,
v40ndr,Many professional athletes are pro-bitcoin because they need a forward-looking mindset to prepare their finances for when their careers end.,2022-06-03T16:29:15.000+02:00,,
v417wk,Meet the new Ledger Nano S Plus hardware wallet,2022-06-03T16:57:13.000+02:00,,
v418zr,,2022-06-03T16:58:42.000+02:00,,
v42n75,"Alright, I'm ready to buy some Bitcoin. Where do I start?",2022-06-03T18:03:50.000+02:00,,
v430fx,"Daily Bitcoin News June 2nd, 2022",2022-06-03T18:20:21.000+02:00,,
v43quz,Matt Pines: Bitcoin is crucial to U.S. national security.,2022-06-03T18:55:04.000+02:00,,
v43xv8,El Salvador is already experiencing the economic ruin IMF was worried about,2022-06-03T19:03:48.000+02:00,,
v44pt2,I miss you so much...,2022-06-03T19:41:36.000+02:00,,
v452da,Trading $20 dollars Amazon gift card for 20 dollars usdt,2022-06-03T19:58:25.000+02:00,,
v46cwo,White House To Ban Bitcoin Mining?,2022-06-03T21:00:10.000+02:00,,
v46mxw,"I was permanently banned from Bitcoin SV’s subreddit for calling it “Faketoshi’s Pet Project”. Any group of people, project, or ideology, who are incapable of hearing criticism, are intellectually shallow and should not be taken seriously.",2022-06-03T21:12:58.000+02:00,,
v46ukg,"A delegation of Bitcoiners followed the invitation of President Faustin Touadéra to visit Central African Republic. The group met with merchants, government officials and representatives of civil society to learn about the plans and progress of the Bitcoin journey.",2022-06-03T21:22:52.000+02:00,,
v47a0d,Making a different approach to a different world: We choose Bitcoin,2022-06-03T21:42:51.000+02:00,,
v4alus,Bitcoin price upper and lower bound curves,2022-06-04T00:21:56.000+02:00,,
v4bh5i,Fr. prox...,2022-06-04T01:05:52.000+02:00,,
v4cqqs,Webull investing( receive a minimum of (90 dollars in stocks),2022-06-04T02:13:55.000+02:00,,
v4d020,How blockchain technology actually works,2022-06-04T02:28:43.000+02:00,,
v4dyt9,How can lightning contribute to carbon negative impact?,2022-06-04T03:21:48.000+02:00,,
v4ect7,,2022-06-04T03:44:08.000+02:00,,
v4epoj,FoaQa eShopping,2022-06-04T04:04:37.000+02:00,,
v4hovp,,2022-06-04T07:05:11.000+02:00,,
v4irqt,Is Bitcoin high or low right now? Bitcoin Chart daily 4h,2022-06-04T08:18:25.000+02:00,,
v4jat9,How to make 100% of your Bitcoins!,2022-06-04T08:56:40.000+02:00,,
v4kkcb,Pls help me and tell If this is a scam!! I have very little knowledge on Bitcoin. How can you gain this much on such less investment. It is surprising. Please help,2022-06-04T10:30:17.000+02:00,,
v4ln9e,When did retail fomo during the last Bitcoin run...any reliable data out there?,2022-06-04T11:53:33.000+02:00,,
v4m09y,India’s CBDC To Be Aligned With Existing Monetary Policies: Will India Ever Accept The Use Of Bitcoin And Other Cryptocurrencies?,2022-06-04T12:20:20.000+02:00,,
v4n2i7,"According to this article, our time seems like the '70s. So it may be easier trading bitcoins than mining.",2022-06-04T13:37:31.000+02:00,,
v4nmge,Introducing New Cryptocurrency to the World,2022-06-04T14:13:38.000+02:00,,
v4rglo,BTC moment=),2022-06-04T17:41:27.000+02:00,,
v4ru4i,Hi can someone verify if this is real or not? Reply quickly as if this is real i only have until tomorrow. Thank you!,2022-06-04T18:00:06.000+02:00,,
v4smqu,Is Bitcoin a Good Hedge Against Inflation?,2022-06-04T18:38:52.000+02:00,,
v4spo0,IS THIS RALLY SUSTAINABLE OR JUST DEAT CAT BOUNCE? - Chamath Palihapitiya,2022-06-04T18:42:46.000+02:00,,
v4vbxr,De-Leveraging The Eurodollar System In Favor Of Bitcoin,2022-06-04T20:53:28.000+02:00,,
v4w119,"Alex Leishman on Building River, Taro Use Cases, and Earning Yield on the Lightning Network",2022-06-04T21:21:13.000+02:00,,
v4w3p4,,2022-06-04T21:25:11.000+02:00,,
v4wmxm,How get $1000 from hsabank.com ?,2022-06-04T21:51:07.000+02:00,,
v4wo3x,Is now a good time to buy the dip?,2022-06-04T21:52:49.000+02:00,,
v4wulm,Proof-of-Prowess Consensus; 99.5% Energy Savings with Existing SHA256 Hardware,2022-06-04T22:01:59.000+02:00,,
v4wwnv,$5000 price target since a break of $30000,2022-06-04T22:04:58.000+02:00,,
v4wyuv,The year is 2050.,2022-06-04T22:08:00.000+02:00,,
v4x3ls,Η Νέα Υόρκη περιορίζει το Bitcoin mining | To Blog της Ελληνικής κοινότητας του Bitcoin,2022-06-04T22:14:50.000+02:00,,
v4xegq,"You seem to be confused, the USD is based on something, and it is called debt.",2022-06-04T22:30:48.000+02:00,,
v4yuml,For sale 5 - canaan Avalonminer 1246,2022-06-04T23:45:24.000+02:00,,
v4z0by,what happened to the main website page?,2022-06-04T23:53:51.000+02:00,,
v4zlkt,,2022-06-05T00:24:03.000+02:00,,
v513d4,How to keep up with crypto - wima space,2022-06-05T01:42:55.000+02:00,,
v51wa0,Where we are now (a retro of 2022 to date),2022-06-05T02:30:03.000+02:00,,
v529sk,What would happen the price if the CCP allowed BTC mining and crypto trading again?,2022-06-05T02:50:29.000+02:00,,
v530o6,Reshaping the future with cold storage solutions,2022-06-05T03:35:05.000+02:00,,
v542fc,Bitcoin invest,2022-06-05T04:38:34.000+02:00,,
v54db9,"I remember seeing this years ago and i thought it was a scam, it’s haunts me to this day.",2022-06-05T04:57:03.000+02:00,,
v55pwf,,2022-06-05T06:23:19.000+02:00,,
v591ie,The eurodollar has been an instrument that allowed for massive global credit and leverage. Bitcoin will benefit from the de-leveraging of that failing system.,2022-06-05T10:26:44.000+02:00,,
v59247,"Bitcoin will be one of ‘best assets on Earth’ after inflation subsides, says commodity strategist",2022-06-05T10:28:21.000+02:00,,
v59cj6,strange narrow range of BTC price,2022-06-05T10:53:06.000+02:00,,
v59v25,"$250,000 per Bitcoin | NO ONE CAN PRINT BITCOIN | GREG FOSS",2022-06-05T11:33:00.000+02:00,,
v5eyki,what do you consider a US Dollar hardfork?,2022-06-05T16:52:44.000+02:00,,
v5g4d5,"Put $15,000 in Bitcoin for my newborn son for when he turns 16+.",2022-06-05T17:48:52.000+02:00,,
v5hnin,What’s the best but right now? ETH or BTC?,2022-06-05T19:03:37.000+02:00,,
v5ibfz,I hope I can communicate with more friends or learn encryption. I am willing to share my success.,2022-06-05T19:36:22.000+02:00,,
v5ifx1,Bitcoin Is The Ultimate Representation Of Energy,2022-06-05T19:42:35.000+02:00,,
v5k8cw,What is the best Bitcoin only debit card in assistants,2022-06-05T21:08:59.000+02:00,,
v5kbb7,free bitcoin click on my link to earn on this website,2022-06-05T21:12:53.000+02:00,,
v5l2iv,,2022-06-05T21:49:55.000+02:00,,
v5qn2o,I made 10 million dollars with crypto this month,2022-06-06T02:35:36.000+02:00,,
v5sp53,,2022-06-06T04:31:09.000+02:00,,
v5t3o4,,2022-06-06T04:54:24.000+02:00,,
v5tioe,Do you guys rebalance? It looks like you might want to start!,2022-06-06T05:19:06.000+02:00,,
v5u6rf,,2022-06-06T05:59:44.000+02:00,,
v5ur2n,"Bitcoin monthly 17: Living on bitcoin, Robosats &amp; software updates",2022-06-06T06:34:22.000+02:00,,
v5v9c8,Got insider information about BTC,2022-06-06T07:07:28.000+02:00,,
v5w8aq,,2022-06-06T08:13:36.000+02:00,,
v5xxvq,,2022-06-06T10:18:29.000+02:00,,
v5y029,This is How you can Build Best Crypto Portfolio for huge Profit and Passive income,2022-06-06T10:22:47.000+02:00,,
v5ygoo,I want to buy my nephew a small amount of Bitcoin and store them somewhere. What's the best option to do do? Necessarily a hardware wallet or is a paper wallet also fine and safe?,2022-06-06T10:58:10.000+02:00,,
v60ttk,I've been writing some educational articles to cover fundamental topics and concepts in crypto. Perfect and simple language for beginners! Please check it out 🙏,2022-06-06T12:58:35.000+02:00,,
v60y28,Can Bitcoiners Avoid a General Crisis? | Erosion of the parasitic economy,2022-06-06T13:05:19.000+02:00,,
v62c7n,,2022-06-06T14:25:33.000+02:00,,
v62s13,https://link.cashandgo.co/u/lamelo212 WIN 50€,2022-06-06T14:49:18.000+02:00,,
v63r1s,Bitcoin rises after snapping longest ever losing streak as investors seek a market bottom,2022-06-06T15:39:03.000+02:00,,
v640qs,"Crypto Market During [and After] The War: Who Will Win? - CoinCheckup Blog - Cryptocurrency News, Articles &amp; Resources",2022-06-06T15:52:00.000+02:00,,
v64fo1,Bermuda gives a thumbs up to its Crypto plans despite warnings from global standard-setting bodies,2022-06-06T16:11:22.000+02:00,,
v64iuc,Can you guess bitcoin’s low for this market cycle on the comments please?,2022-06-06T16:15:29.000+02:00,,
v64qtc,This is why we need bitcoin. The government in Australia now uses tax payer money against its own citizens to track every citizens credit card purchases and goe-location data to spy on their activities and movement in real time across local government areas.,2022-06-06T16:25:51.000+02:00,,
v65clf,"Gentlemen. Congratulations on my birthday! Crypto cake is simply the best I've ever had. It's unbelievably delicious pistachio-raspberry. As the bulls say, muuuuuuuuuuuuuuuuuuuuuuuuuu! I hope my holiday spirit will pass on to all of you ;)",2022-06-06T16:53:52.000+02:00,,
v65mp9,Where does liquidy/ capital come from on a BTC loans?,2022-06-06T17:06:01.000+02:00,,
v66648,"‘$500,000 In Five Years’—Elon Musk And Tesla Devotee Cathie Wood Reveals Huge Bitcoin And Ethereum Price Predictions - Forbes",2022-06-06T17:30:52.000+02:00,,
v68iv5,Bitcoin to xmr wallet,2022-06-06T19:15:55.000+02:00,,
v69ve7,"The game is an up-and-coming Action Thriller Game. The FPS Game is an AAA-level shooter game in a fantasy metaverse. In the game, players can compete in different game modes while completing missions, quests, or challenging themselves. Meanwhile, there is also a means to unlock time traveling and te",2022-06-06T20:15:50.000+02:00,,
v6ajd2,New bitcoin community for anyone open to debate on crypto,2022-06-06T20:46:32.000+02:00,,
v6alwu,for all of artist,2022-06-06T20:49:38.000+02:00,,
v6b8yx,$10 free bitcoin,2022-06-06T21:17:43.000+02:00,,
v6bc1f,Remember LaBitConf in El Salvador?,2022-06-06T21:21:38.000+02:00,,
v6dqkr,"Traders think Bitcoin bottomed, but on-chain metrics point to one more capitulation event",2022-06-06T23:09:04.000+02:00,,
v6fk4q,iOS Wallet App Recommendation,2022-06-07T00:30:56.000+02:00,,
v6gqsz,Your emotions are not defined by the money you have. It is entirely up to you how you react to what is going on around you. As you were building your fortune you must also build your attiude.,2022-06-07T01:28:04.000+02:00,,
v6gsfr,Money team,2022-06-07T01:30:10.000+02:00,,
v6ioao,,2022-06-07T03:07:13.000+02:00,,
v6jvsr,Point errors in this article.,2022-06-07T04:09:28.000+02:00,,
v6l0jd,,2022-06-07T05:08:26.000+02:00,,
v6n8bv,Charles is pissed but he is right.,2022-06-07T07:14:47.000+02:00,,
v6nxix,The Gold Standard MYTH,2022-06-07T07:58:54.000+02:00,,
v6phxb,The official website of the US Fed now has a page with the ratio of eggs to bitcoin. 🍳🚀,2022-06-07T09:38:22.000+02:00,,
v6pisw,In Search of The Perfect DeFi Application – The User Viewpoint | MINIMAX FINANCE,2022-06-07T09:40:05.000+02:00,,
v6psdg,😢😢😢😢😢,2022-06-07T09:58:23.000+02:00,,
v6q5b0,China is wasting more and more clean energy as it adds wind turbines and solar panels faster than its grid is able to digest them.,2022-06-07T10:23:16.000+02:00,,
v6qfpf,How to get free bitcoin &amp; Ethereum machine?!!?!! 💯%(Legit),2022-06-07T10:44:11.000+02:00,,
v6reji,"‘$500,000 In Five Years’—Elon Musk And Tesla Devotee Cathie Wood Reveals Huge Bitcoin And Ethereum Price Predictions",2022-06-07T11:52:17.000+02:00,,
v6rufi,Metaverse Crypto Coin with BUSD Rewards,2022-06-07T12:21:09.000+02:00,,
v6v06b,Here's Who I think Constantly Dumps Bitcoin on Crypto Market,2022-06-07T15:05:10.000+02:00,,
v6vkux,"‘$500,000 In Five Years’—Elon Musk And Tesla Devotee Cathie Wood Reveals Huge Bitcoin And Ethereum Price Predictions",2022-06-07T15:29:29.000+02:00,,
v6xp7g,BTC strategy?,2022-06-07T16:48:29.000+02:00,,
v6zjbh,Is Decentralization Binary or a Spectrum?,2022-06-07T17:55:13.000+02:00,,
v6ztjv,"JUST IN - PayPal users in the US can now transfer, send, and receive #Bitcoin and other cryptocurrencies starting today.",2022-06-07T18:04:58.000+02:00,,
v717sa,,2022-06-07T18:54:11.000+02:00,,
v72w31,House Price Index for the United States Priced in Bitcoin (FRED Data),2022-06-07T19:55:41.000+02:00,,
v734i7,,2022-06-07T20:04:05.000+02:00,,
v73rl1,How was bitcoin listed on the stock exchange?,2022-06-07T20:28:29.000+02:00,,
v78bu6,,2022-06-07T23:33:05.000+02:00,,
v7a6no,how much have you profited or lost from bitcoin,2022-06-08T00:49:40.000+02:00,,
v7bleg,"\"Secretary Yellen: \"\"I do expect inflation to remain high",2022-06-08T01:57:05.000+02:00,,
v7e0xw,Keep it simple,2022-06-08T03:59:35.000+02:00,,
v7edga,I’m starting to get nervous…😅,2022-06-08T04:16:35.000+02:00,,
v7fjzd,Best open source lightning wallets with direct APK installers,2022-06-08T05:17:04.000+02:00,,
v7fm7y,"Coinbasis's native token BasisCoin (abbreviation: BSC) was officially launched in April, with the four major chains of ERC, Heco, BSC and TRC. https://t.me/LiNaoO0",2022-06-08T05:20:24.000+02:00,,
v7h511,Chad Saylor continues to own Bitcoin denieres and keeps educating everybody (who would listen) every day,2022-06-08T06:46:25.000+02:00,,
v7ik0i,https://www.instagram.com/invites/contact/?i=1ltdutsoq2wu7&amp;utm_content=og4g48u,2022-06-08T08:12:10.000+02:00,,
v7kn2z,I created crypto mini-game: don't like the asset price? Explode it with a tap! Hope this help stand bear market with a smile :),2022-06-08T10:32:23.000+02:00,,
v7kos5,"BITCOINERS 99% of the worlds population could not care about BITCOIN…what do you say to them, please try to be articulate and not emotional, as I think this is partly why the general population is not interested!",2022-06-08T10:35:55.000+02:00,,
v7l9so,Guys this is the big one we waited for,2022-06-08T11:16:35.000+02:00,,
v7n6xc,GST on Crypto: Cryptocurrency Exchanges to pay 1% TDS from Next Month,2022-06-08T13:19:17.000+02:00,,
v7n794,"Guy buys laptop with 60BTC in 2015, spends it all (I would have too). Imagine finding that today!",2022-06-08T13:19:53.000+02:00,,
v7o6ps,BTC Price Movements from data: CAN THIS WORK?,2022-06-08T14:13:20.000+02:00,,
v7o8j3,A BTC Trader's technical analysis: Data,2022-06-08T14:16:03.000+02:00,,
v7odni,Best Way To Invest As A BTC Bull WITHOUT Buying BTC,2022-06-08T14:23:33.000+02:00,,
v7pl4b,"\"Ex Twitter CEO Jack Dorsey is \"\"All In\"\" on Bitcoin.\"",2022-06-08T15:24:21.000+02:00,,
v7q8er,"\"Laboratory Greece (2019) - The documentary examines Greece's economic and financial crisis. The debt repayment program, which the IMF, ECB and European Commission implemented on Greece. Over 95% of the resources intended to \"\"save\"\" Greece ended up in the hands of national and international banks.\"",2022-06-08T15:55:52.000+02:00,,
v7qgyt,W S P P ~ Giveaway,2022-06-08T16:06:36.000+02:00,,
v7qs4o,Bitcoin Sell-Off Is Over Now It Will Spike | Raoul Pal,2022-06-08T16:21:26.000+02:00,,
v7recs,The Culture Wars with Michael Moynihan — What Bitcoin Did,2022-06-08T16:49:43.000+02:00,,
v7syeh,Giant Bitcoin sand art by Someone,2022-06-08T17:59:16.000+02:00,,
v7t0dr,I’ll soon be running the third Lightning Network node in my country and it genuinely feels like we’re early.,2022-06-08T18:01:21.000+02:00,,
v7xlq5,Get up to $400 in referrals,2022-06-08T21:19:59.000+02:00,,
v7ybep,vibes 🤞💴💴,2022-06-08T21:50:54.000+02:00,,
v7zfcg,Proposed Crypto Bill TLDR [Didn't Fact Check],2022-06-08T22:39:06.000+02:00,,
v7ztz1,Bitcoin is a ponzi scheme,2022-06-08T22:57:20.000+02:00,,
v80iz6,I hope she made your day better!,2022-06-08T23:28:48.000+02:00,,
v82twt,Terra Luna 2 Second Airdrop Terms,2022-06-09T01:19:46.000+02:00,,
v83czl,bitcoin recovery,2022-06-09T01:47:08.000+02:00,,
v83v98,crypto currency,2022-06-09T02:13:08.000+02:00,,
v8779q,"X To Earn, DAO...Which Tracks Could Be Amazing Killer Crypto 2022?",2022-06-09T05:10:34.000+02:00,,
v89axr,Elon gets it,2022-06-09T07:13:51.000+02:00,,
v89xmv,Hello,2022-06-09T07:54:17.000+02:00,,
v8ba62,Robinhood vs cash app with new robinhood wallet buying and sending Bitcoin best option?,2022-06-09T09:25:51.000+02:00,,
v8cqk8,Deals on gift card and crypto,2022-06-09T11:14:35.000+02:00,,
v8d5te,Miami Bull - sculpture? Does anyone know if the Bull is available as a sculputure?,2022-06-09T11:44:51.000+02:00,,
v8hrdt,India's topsy-turvy stance on cryptocurrency paired with a doubtful prime minister - a recipe for disaster?,2022-06-09T16:13:43.000+02:00,,
v8i133,,2022-06-09T16:26:53.000+02:00,,
v8jkky,Did I just screw up by sending bitcoin from coinbase to wallet of satoshi? Would it work. I expected it to show by now.,2022-06-09T17:37:58.000+02:00,,
v8jqhz,When does the hodling take effect,2022-06-09T17:45:34.000+02:00,,
v8k3y5,The Irresponsible Financial Innovation Act,2022-06-09T18:02:19.000+02:00,,
v8kygq,What is the Bitcoin Academy?,2022-06-09T18:40:39.000+02:00,,
v8l2rp,"Give someone a bitcoin, and you feed them for a day. Teach someone how to bitcoin, and you feed them for a lifetime.",2022-06-09T18:46:14.000+02:00,,
v8m8pn,Is TERRA LUNA Still Alive?,2022-06-09T19:37:36.000+02:00,,
v8mf0s,What a handsome man!,2022-06-09T19:45:20.000+02:00,,
v8pid1,"Install CryptoTab Browser and get real Bitcoins for using it. Your earnings will keep growing as long as you're watching YouTube, reading news and using your social network accounts daily.",2022-06-09T22:02:42.000+02:00,,
v8pytt,Do you got any fiat left?,2022-06-09T22:23:10.000+02:00,,
v8qo4m,Tokenisation,2022-06-09T22:55:00.000+02:00,,
v8s9r0,,2022-06-10T00:07:31.000+02:00,,
v8u01i,"DyoR, Huge drop expected as SP500 closed in the red anticipating tomorrows inflation numbers",2022-06-10T01:31:35.000+02:00,,
v8uklh,Crypto Cramer,2022-06-10T02:00:26.000+02:00,,
v8xrzx,"!! Click on MEXC's recommended link! There are many regulations on domestic exchanges, such as preventing withdrawals with personal wallets such as metamasks It's uncomfortable because it's not user friendly. MEXC is one of the top 10 medium and large exchanges, and the UI is very simple Bin",2022-06-10T04:53:28.000+02:00,,
v91h4f,Lower Your Time Preference,2022-06-10T08:37:47.000+02:00,,
v93ffr,combining them with second-layer networks like lighting network,2022-06-10T10:58:33.000+02:00,,
v94amd,How to check BIPs in Core?,2022-06-10T11:59:52.000+02:00,,
v94h4x,"How to get the maximum benefit from the miner, this is the secret that no one will tell you!",2022-06-10T12:11:21.000+02:00,,
v95ivy,"If i use a brain wallet, can i deduct the cost of mantaining basic living costs as tax deduction?",2022-06-10T13:21:20.000+02:00,,
v96zc7,"How to buy and sell $10,000,000 in bitcoin.",2022-06-10T14:45:54.000+02:00,,
v972gi,BitFuFu 2022 Mid-Year Celebration！！,2022-06-10T14:50:48.000+02:00,,
v9849i,Best Cryptocurrencies To Invest In Australia in 2022,2022-06-10T15:45:56.000+02:00,,
v98lkm,"The Fed, Inflation and Bitcoin with Steven McClurg — What Bitcoin Did",2022-06-10T16:09:00.000+02:00,,
v98nai,Meanwhile in Nigeria,2022-06-10T16:11:15.000+02:00,,
v99bnl,CPI 8.6%,2022-06-10T16:43:33.000+02:00,,
v9a8jf,WALL STREET SHORTING BITCOIN AND MICROSTRATEGY | GREG FOSS,2022-06-10T17:25:38.000+02:00,,
v9bs8f,Cheapest way to buy BTC,2022-06-10T18:36:24.000+02:00,,
v9d5al,Save our assets,2022-06-10T19:38:33.000+02:00,,
v9eknb,,2022-06-10T20:44:16.000+02:00,,
v9f3xh,Jack Dorsey’s TBD Presents Bitcoin-Based Decentralized Web5,2022-06-10T21:09:11.000+02:00,,
v9g0vd,,2022-06-10T21:52:35.000+02:00,,
v9i3in,BTC Logo Design,2022-06-10T23:30:02.000+02:00,,
v9m2nl,,2022-06-11T02:52:51.000+02:00,,
v9mxdr,Flash btc software latest upgraded version 10.03 available: BTC AC tool + Server Logs + Bypass File + Main File Flash Min 1 btc upto 5000 btc per day Tradable and Splittable Validity 240 days Unlimited wallet transfer Only wallet address required to flash btc (No web qr code or blockchain vers,2022-06-11T03:41:46.000+02:00,,
v9nk4r,Bitcoin THE Blockchain and the hanging bridges,2022-06-11T04:18:46.000+02:00,,
