id,title,created_utc,body,comment_created_utc
Bob has 7 dollars and Harry has 20 dollars to start with. And there is an apple in a room.,,,,
I sent bitcoin to the winners choice of charity,,,,
"5:01 AM\"\"",,,,
6 transactions were deposits to the address one was a withdrawal of like .0003 bitcoin ( I was testing if another address I own works because I’m paranoid whenever I make a new address).,,,,
Bitcoin came onto the scene,,,,
Bitcoin has performed incredibly well in the past,,1970-01-01T01:00:00.000+01:00,,
Bitcoin is the status quo. Everyone has a Bitcoin wallet (or LN wallet),,,,
Carpenter by trade,,,,
Fold won't accept my Strike account for funding.,,,,
I Guess no judge could take them from my ledger ans give them to her,,,,
I admire you. You can now start setting up a savings plan all the way down to whatever dollar value Bitcoin might go during the recession. On the way up,,,,
I can't connect to any channels AFAIK.,,,,
I can't help but be concerned about one thing: the privacy of the transactions.,,,,
I can't imagine that there will really be room for a large number of digital mediums of exchange in the future.,,,,
I decided to move the rest. In some way it looks like a leap of faith,,,,
I do not see anyone really discussing the danger of dropping below the cost to mine. If that happened,,,,
I do want to see all the Asset Managers,"Do not buy Bitcoin, yet!",,,
I don't mind too much leaving it on the exchange company,,,,
"I don’t know how exactly they will invest in this. I can’t get more details.\"",,,,
"I have gradual transition to being a BTC maxi because it did exactly what I wanted to do from the starting. \"\"Storing the value that I created with my skills\"\".",,,,
I have used CashApp when Coinbase was down during Coinbase outages (Seemed to always happen during market dips in the past),,,,
I have watched every rise and fall,,,,
I learned about the project. At the time,,,,
I quickly realised my stupid mistake.,,,,
"I sold a 2016 Ford Focus RS with a fully built Mountune high performance long block and EFR-7163 turbo!\"",,,,
I think it has exceeded that taking into account the split (so cap wise).,,,,
I think this is it.,,,,
I thought about it a bit. I seems to me that if I buy bitcoin,,,,
"I will update in 6 months.\"",,,,
I wouldn't mind hearing what your favorite platform is with purchasing Bitcoin. I have fractions of Bitcoin on multiple apps that I've never really seen the effort of grouping them together since they're such small amounts. With one big egg in the basket,,,,
I'd like to see some DeFi action _without_ speculation - I really would like more control over the money I actually own,,,,
If any of you have tried premium versions of these would really appreciate the feedback.,,,,
I’ve been contemplating two gameplans:,,,,
"Japan and Britain to US monetary and military hegemony.\"",,,,
Lighting Network will enable high power monopolies to dictate BTC transactions. Benevolent or not,,,,
MONEY,,,,
Mullvad VPN accepts BTC as a payment method.,,,,
NOT YOUR BITCOIN,,,,
Riot reserves the right to select from the pool of questions. Keep them reasonable and please remain cordial!,,,,
Silver,,,,
Steven &lt;steven.rando@.com&gt;,,,,
a Ledger Nano S for example is at least 4x more expensive comparing to Brazilian non-official sellers. This is making me think if is really that secure.,,,,
a bank safe deposit box,,,,
a person can just send some/all funds to another address and avoid the blacklisting of that address?,,,,
a span of 4 years (May 2018 - May 2022) and calculated with buying for $2 an hour.,,,,
all mafias,,,,
all they need to do is crack my pin to access my funds right? Since the live ledger app doesnt actually have anything related to access my funds and doesnt do anything except serve as a interface. correct?,,,,
and  an inescapable way of organizing human activity,,,,
and I connect it to another channel. I receive 5 bitcoins through those channels.,,,,
and also they will earn on it with taxes,,,,
and gambling,,,,
and have to convert my crypto into fiat to pay for those costs.,,,,
and more and more bitcoin hardcore fans abandon the network,,,,
and that will continue in perpetuity.,,,,
and through such moderate gastrointestinal irritation,,,,
and what you can access is at the discretion of the bank. This is mainly because the money has all but been stolen,,,,
"anyone who buys and holds will win\"\" is also something that's not guaranteed to happen. It's only true if more people keep putting more money into Bitcoin",,,,
as Bitcoin's value as pristine collateral increases. The risk of lending it out to 3rd parties who rehypothecate via risky fractional reserve lending tactics - inflating and manipulating the market by selling paper bitcoin whilst absorbing real world bitcoin demand,,,,
as I pay fees every time I convert crypto.,,,,
bear markets,,,,
because no one can predict what other sellers will do in an environment that is potentially being pumped by the massive purchases of a spot etf. But unless I'm missing something,,,,
bitcoin has a lot of utility as a currency. Probably isn't the easiest way to pay for a cup of coffee,,,,
but I don’t understand the idea of “go away market,,,,
but I need some advice as I don't want to mess anything up.,,,,
"but any ideas to make this system better would benefit everyone.\"",,,,
but for an S9J Miner on Newegg:,,,,
but it doesn’t let you buy or get paid in bitcoin like CashApp and Strike.,,,,
but its hitting $18K almost now.,,,,
but keep Bitcoin Core running at all times.,,,,
but my mining rigs are still working hard even can earn a little.,,,,
but not anonimous. Take this into account when making transactions,,,,
but now I'm found.,,,,
but to just better understand the pros and cons of every argument. And of course,,,,
buy about .20 BTC,,,,
can or may Blockchain took over my wallet?,,,,
certirus paribus. Of course,,,,
come out of nowhere from an anonymous person,,,,
conferences,,,,
could Bitcoin survive this information being made public knowledge? If true,,,,
deeply research seed phrase security. Find out what works for you. At a bare minimum,,,,
do they need to only use Bluewallet to gain access to the BTC or would it work with other wallets that follow the same protocol?,,,,
don’t buy into it. This won’t crush crypto. If anything,,,,
electricity and the profitability is mainly given by price,,1970-01-01T01:00:00.000+01:00,,
especially with all the btc maxi’s that are blinded by their vision for any counter-arguments.,,,,
even more than the regular budget.,,,,
even ones at odds,,,,
everything is a great investment haha a bottle of cooking oil has 12x in last 30 days,,,,
except to say that it’s overall been a good read,,,,
fast and with almost unlimited throughput),,,,
feedback,,,,
feedback,,,,
feedback,,,,
feedback,,,,
feedback,,,,
fiat is not. You dont own any money,,,,
fixed cost and labor etc.  20BTC/ year. 4 BTC profit yay!,,,,
for example the Tor DDoS attack.,,,,
fully risk free,,,,
get it off any exchange or website NOW. Don’t leave it on Coinbase,,,,
good on you,,,,
"he will say \"\"ah",in which the LN would not immediately collapse.,,,
highlight with your highlighter each letter (again,,,,
hoping we eventually go back to 17K levels before reaching my liquidation price,,,,
how will miners be rewarded for their effort to contribute to the blockchain?,,,,
however just excluding that best we can,,,,
i **KNOW it already exists**,,,,
i tried to use “CryptoWatch - Desktop Tracker”,,,,
if not for that pesky key function: hold its value. This point is non debatable,,,,
if yes - which?,,,,
if you do a TA on the trends,,,,
if you like it and want to tip me. That would encourage me to write more from my understanding and earn sats: LNURL1DP68GURN8GHJ7AMPD3KX2AR0VEEKZAR0WD5XJTNRDAKJ7TNHV4KXCTTTDEHHWM30D3H82UNVWQHKSMMVD3HHWAM9V4JR2VGFGQJWT,,,,
including interest-based loans,,,,
instead of Alice sending the proof of deposit to Bob they create a multisig sharing the proof. For Statechains the proof is turned into a statecoin. The proof basically takes the place of a regular transaction not tying it to any one UTXO.,,,,
instead of like the previous link that more so tries to use imagery to better relay the message: [https://www.nasdaq.com/articles/bitcoin-fixes-the-modern-fiat-ponzi-scheme-2021-09-14](https://www.nasdaq.com/articles/bitcoin-fixes-the-modern-fiat-ponzi-scheme-2021-09-14),,,,
"is something like this possible?\"",,,,
"is there any trading platform that will lend me 1700 dollars say if I deposit 300 dollars? better if I can do margin call \"",,,,
it automatically values in dollars in my mind,,,,
it is NOT conspiracy theory: https://www.gata.org,,,,
it is never the case.,,,,
it is ridiculed. Second,,,,
it turns out that halving 24 takes the block reward from 0.00000596 BTC (or 596 sats) down past the dust limit to 298 sats,,,,
it updates the ledger with the transaction and transfers that answer to him. By looking at the transaction history,,,,
it's called shorting the market..,,,,
it's sheer luck. You have no idea when you're going to wake up and find that your AssCoin went to zero.,,,,
it’s been reluctant to reveal details,,,,
lets make this community better in the future and collectively dissuade the behaviors I'm talking about,,,,
like the first time you see immersion mining. You have to physically break it in order to send the funds. But again,,,,
longest running codebase of money,,,,
lots of people talking about never reaching below previous ATH or pre-halving lows.,,,,
many issues. Copy pasting from another comment (not mine):,,,,
many transactions between people are recorded.,,,,
money was printed with practically zero interest rate. The effective interest rate is therefore negative. Your bank account balance stays the same but the loaf of bread becomes more expensive. It's the same thing when your bank account has a negative interest rate chipping away from your saving and the loaf of bread keeping the same price.,,,,
"most/highest coin holders are institutions?\"",,,,
no attitude or bad vibes intended.,,,,
no other personal info or any other info in general.,,,,
no the only tool to connect to outside world financially,,,,
none of them have admitted their HUGE mistake,,,,
not giving a damn shit about any highfalutin crypto-bro drivel.,,,,
not the miners,,,,
on 2010-07-25 at 01:35:23 at Block height 70071,,,,
or 'It's still dropping,and stick to your **long term** plan.,,,
or Bitcoin,,,,
or able to run their Blockchain backup decryption tool to help me.,,,,
or am I being dim?,,,,
or an old page that needs polishing,,,,
or something like that? I get it,,,,
or try to get on board with FUcoin and accumulate it so we have the universe reserve currency and can buy things from other Galaxies that we need and can't produce ourselves.,,,,
or will Chinese Yuan become dominant and seek to crush Bitcoin opportunities?,,,,
plain and simple. You use it to buy things,,,,
please ignore the bad English. It is not my first language. I will gradually proof read.,,,,
please let me know :),,,,
property taxes,,,,
reach out in the [\#opportunities](https://bitcoindesign.slack.com/archives/C016D659EU9) channel in Bitcoin Design Slack.,,,,
regardless of how shit it feels. Also,,,,
setting 6 limit buys at:,,,,
settles any doubts that still creep into my negative imagination soul,,,,
slaves,,,,
so I'm going to change my dollars to Euros. 🤣🤣🤣,,,,
so Maki will take care of all the technical stuff and provide you with a set of endpoints to access transaction,,,,
so for everyday user this doesn't change things much. I decided to write this up because IMO the mis-information does much more harm than good.**,,,,
someone else doesn’t even own Bitcoin.,,,,
sometimes known as DCEP.,,,,
such as a display,,,,
such as war,,,,
sweet hopium? I know it's all just logarithmic regressions,,1970-01-01T01:00:01.000+01:00,,
"tell me I'm right!\"",,,,
thanks for reading.,,,,
"thanks in advance! :)\"",,,,
that is a more than reasonable time to see some returns in BTC.,,,,
that there is new mining-tech every year and stuff gets faster ( for example the new GTX 3090 are way better than the Graphic cards in lets say 2018).,,,,
the [Pax Dollar contract](https://etherscan.io/token/0x8e870d67f660d95d5be530380d0ec0bd388289e1) is functional and active. $USDP is fully active on other exchanges.,,,,
the addition of bitcoin to the platform will not be going away for the United States eBoutique. The company partnered with BitPay to bring the functionality to this limited release,,,,
the answer to that question is that bitcoin dies often. It has fallen by 50 per cent or more at least seven other times.,,,,
the chain will be censored.,,,,
the company can [keep posting more collateral](https://coinfomania.com/microstrategy-bitcoin-margin-call-3652/) until Bitcoin **drops as low as $3562!**,,,,
the difficulty of generating more of an asset,,,,
"the government has some hard choices if it is not going to fail. It needs to do something so that the \"\"black market\"\" is legalized and taxable",,,,
the most interesting thing about bitcoin is the price in USD. Thus you are either dirty speculator,,,,
the relative size of the financial sector would return to that last seen during the gold standard (less than 5% of GDP)…,,,,
the wordcel debt scam market has to Darwinian self select out of the economic gene pool. You are seeing evolution unfold in real time,,,,
then it is just more user friendly,,,,
then stay brainwashed sheep and good luck with that cuz I will get this out eventually and the entire thing is going to fall. Here's a video https://www.reddit.com/r/Bitcoin/comments/va36st/here_is_a_video_that_is_relevant_to_my_last_post/?utm_medium=android_app&amp;utm_source=share,,,,
then that would be a historic pivot that should send a shiver down your spine,,,,
theoretically,,,,
they need apple. And now Alice really needs an apple,,,,
they're putting in the work to make this a reality.,,,,
thinking,,,,
"this happened before and I shrugged it off since Cash app said funds failed. This time that has not happened yet.\"",,,,
this shit is going to disappear into the internet stack. And the sooner we're the internet of money,,,,
those who lost i wish all the best to recover as soon as possible,,,,
through Bitcoin as the every day currency to transact at all scales globally. Its use and its value determined by its adoption. With a limited number of Bitcoins by design,,,,
to take the rubes for a ride,,,,
to verify the address first,,,,
together. The masses ate it up.,,,,
transparency,,,,
"unless you make bitcoin.\"",,,,
we are exiting a weaker currency for a stronger one. It's not really an investment,,,,
we are so much further along today compared to then.,,,,
we may have to include your product in a backlog.,,,,
"we were in uncharted territory due to the amount of institutional investors in crypto. \"\"We will not have 90% corrections anymore. Crypto has matured. There are too many big players involved for it to happen.\"\" And yet even though we continiously enter uncharted territory we always seem to fall back into the same 4- year-cycle.",,,,
we will have a recession. If rates don’t go up we will have a depression.,,,,
we would love to bolster our efforts in this regard and start answering more and more questions from the retail community. We value your continued support and want all shareholders to feel confident in their investment.,,,,
"well there's a long list of things to get banned too I guess.\"",,,,
well where did they get the money from? Well,or when they do spend money they want to spend it on things that are going to last a long time.,,,
we’ll recover from that. Today I want to show you my new project. After 8 months of development it’s finally finished. The past years I’ve learning programming and I wanted to apply some of the stuff that I learnt to Bitcoin. So,,,,
what chances are that the population will abandon Bitcoin in favor of this new currency,,,,
what do you think about this Idea?,,,,
where they can in turn lend to someone else. Other than that,,,,
which gets green or checked if the Information is signatured by the named Source (Signature should contain a hash of the message so it cant be faked).,,,,
which has grown in intensity after plans were announced to begin raising interest rates from record lows.,,,,
which of course benefits and consolidates BTC in stronger (more deserving) hands.,,,,
which offers retail Bitcoin trading and spent $220 million to hold Bitcoin on its balance sheet,,1970-01-01T01:00:05.000+01:00,,
which takes the historical data of bitcoin price and charts the future trajectory of its price movement,,,,
who knows! I could be very wrong.,,,,
why isnt the price of gold much higher? Gold is far more scarce than fiat,,,,
why they do it? I get it for some stablecoin or other crappy coin,,1970-01-01T01:00:00.000+01:00,,
wikis etc),,,,
wikis etc),,,,
wikis etc),,,,
wikis etc),,,,
wikis etc),,,,
will I be able to transfer that to a cold wallet like one of the Ledger ones for safe keeping. Then,,,,
will not have the financial freedom to pursue projects which might take time.,,,,
would you partition 0.5 across different addresses? Or would you store it all in one address?,,,,
yep.,,,,
yep.,,,,
yep....... or so I thought.,,,,
yet is always larger than it was the time before…so the overall market is actually growing regardless of those who fold?,,,,
you can lose it,,,,
you can negotiate a payment with a long chain of nodes,,,,
you can try to close the channel,,,,
you can’t see at what price this large volume passed](https://preview.redd.it/ddly35ocj7391.png?width=906&amp;format=png&amp;auto=webp&amp;s=d6b9032522f82d7c3908dc8fbf0c8d8caf0554c6),,,,
you cease to be political because left and right become the same. Each side appealing to their respective pathos while ignoring the underlying systemic issue. Frank Zappa said it best: Politicians are the entertainment division of industry. When industry is placed in a system that incentivizes short time horizons and an inflationary spirit,,,,
you get 1 BITCOIN,,,,
you'll have built a business that profits only when its customers do well,,,,
you'll lose money.,,,,
your counter party could have/create a completely anonymous wallet.,,,,
"\"08-Jun-2011: Great #Bitcoin Bubble\"\" at $32 at 11 years ago.....BUT NOW?\"",,,,
"\"Every time someone says \"\"Tulip Mania\"\"",,,,
"#bitcoin is the most scarce asset in the world and the scoreboard should be the accumulation and not what price you buy at.",,,,
$50K,,,,
000,,,,
000,,,,
000 miners lose money.,,,,
000 per $MSTR CFO.,,,,
026,,,,
050.00 Stimulus Checks are Back on the Menu](https://preview.redd.it/4c8ksppb4i891.png?width=739&amp;format=png&amp;auto=webp&amp;s=5415e948c32b24cc26f38ff6e8b958f81220784f),,,,
082. It seems whales are buying the dip in bitcoin,,,,
096 INFO  fr.acinq.eclair.Boot - json API enabled on port=8080**,,,,
"1 Bitcoin = $18.2k at the time of this post, and moving… there is not enough data, so there is no bottom.",,,,
182,,,,
320.00 USD,,,,
333,,,,
455 5/26,,,,
620 5/10,,,,
640.00 USD,,,,
697 5/25,,,,
721,,,,
750 4,,,,
791,,,,
800 5/12,,,,
846 INFO  f.a.e.b.b.zmq.ZMQActor - connected to tcp://127.0.0.1:29000**,,,,
846 INFO  f.a.e.b.b.zmq.ZMQActor - connected to tcp://127.0.0.1:29000**,,,,
956,,,,
Advice from Authur Schopenhauer,,,,
"After 6⃣️9⃣️4⃣️ days, we will meet the Bitcoin halving. The bull may come also haha. So be faithful and keep mining or holding! 🧚🏻",,,,
Alternatives to Paxful that support gift cards?,,,,
Am I right about Bitcoin problem ? 🤔,,,,
Are you happy with Bitcoin’s returns this cycle?,,,,
BTC auction? (Coinbase Pro),,,,
BTC for Fathers day!,,,,
Best way/method to buy+store bitcoin now (for long term),,,,
Beware of the Google Forms scam,,,,
Bitcoin Mobile Test Wallet,,,,
Bitcoin Research Survey - First 20 participants will receive a $10USD Amazon e-voucher,,,,
Bitcoin and privacy,,,,
Bitcoin is at a stage when the people with ability to print infinite fiat monopoly money can artificially manipulate and supress the dollar exchange rate. But we have a simple weapon to stop this.,,,,
Bitcoin mark pricing,,,,
Bitcoin mining to save the environment,,,,
Brigading on the daily thread.,,,,
Buying now and locking for 1-2y,,,,
Can't login my Blockchain 2013 .JSON wallet,,,,
CeFi or Cold Storage?,,,,
"Chill the f*ck out, not the first nor last recession",,,,
"Coinbase BTC activity: 84% buy, 16% sell",,,,
Considering moving to cold storage/hard wallet but what are the tax implications?,,,,
"Daily Discussion, June 01, 2022",,,,
"Daily Discussion, June 04, 2022",,,,
"Daily Discussion, June 10, 2022",,,,
"Daily Discussion, June 11, 2022",,,,
"Daily Discussion, June 22, 2022",,,,
"Daily Discussion, June 23, 2022",,,,
"Does anyone else find this most recent Bitcoin crash great? I mean really, now we have the opportunity to load up.",,,,
Eclair Lightning Setup with Bitcoin Core,,,,
Electricity pricing rising effecting Bitcoin pricing,,,,
"Everyone, everywhere has the same opportunity right now",,,,
Fear of FIAT collapse,,,,
Former Police Experts Tried to Escape With Millions of Seized Bitcoins,,,,
HODL Times create Strong Hands (A short Poem) :),,,,
Help! What do I do with my bitcoin,,,,
How do I transfer bitcoin from coinbase wallet to “cold storage”?,,,,
How to best configure multiple nodes (and the router) on the same home network?,,,,
How to move coins from hot wallet to cold wallet,,,,
I Remember the Last Crypto Bear....,,,,
I like Bitcoin b/c it's neat.,,,,
I've created an API to access the Bitcoin blockchain in a simple way,,,,
ID required for verification with Google Pay,,,,
"If a BTC newbie isn't afraid, then so shouldn't be you",,,,
In Defense of Proof-of-work,,,,
In need for some basic education about BTC &amp; the fundamentals,,,,
In the case of a downfall of fiat currency how would bitcoin work without a way to value it?,,,,
"Infinite money printer caused inflation and now the fed is fixing it causing a depression, the biggest attack on bitcoin is going on",,,,
Intrinsic value of BitCoin,,,,
Is it Reasonable to Mine Bitcoin from Solar on Your Home?,,,,
"It took a couple of years, but finally made it!",,,,
Keeping Crypto off Exchanges,,,,
Market so bad....,,,,
Mobile Wallet that supports Wallet Import Format (WIF) without creating a transaction?,,,,
Multi Sig Wallet(s),,,,
My luck is smiling 😂,,,,
Not fortunate enough to buy some of the dip…,,,,
Orange-pilled myself reading,,,,
Problems with Bitcoins Mined in 2009,,,,
Protect your BTC - Beware of YouTube Impersonation Fraud,,,,
Question for the Plebs,,,,
"Question: Does a strong dollar collapse other currencies? If so, will other countries run to BTC or USD?",,,,
"Raise interest rates, lower interest rates, it's all zero sum. Bitcoin removes the game entirely.",,,,
Reminder: Please review your security practices while stacking sats,,,,
"Safepal, Ledger or Trenzo?",,,,
Seeding torrents for Satoshis - is this idea possible?,,,,
Sold ALL my Bitcoin for Fiat/Alts/Startups,,,,
Some expert help?,,,,
Some question to the BTC network,,,,
Some questions about Bitcoin,,,,
TIL: The main character of Pokemon is named Satoshi.,,,,
"The one job of an investor, Bitcoin, debt slavery, and why market crashes are good for humanities future.",,,,
This crash--an amazing opportunity?,,,,
This is exciting!! BIS allows banks to hold upto 1% in crypto in their reserves,,,,
This is why Bitcoin was invented.,,,,
Trezor Model T OK?,,,,
"Two things are true every cycle, UNTIL NOW. Be prepared for the FUD when they are broken...",,,,
WHERE is the best place to dollar cost average into BTC?,,,,
What do you think of Bitcoin and other cryptocurrencies? Are they the future of finance? Represent your views in a very short academic research survey!,,,,
What do you think to my investment strategy? (£10000),,,,
"What is Layer 1, Layer 2 and Layer 3 in blockchain?",,,,
What's your UTXO count?,,,,
Where can i buy bitcoin saftley for low fees,,,,
Where should we take cover at 65 yrs old?,,,,
Which is better? Coinbase or Gemini?,,,,
Who is satoshi .. just curious if this has been ever solved.. if you can find him you can find his motivations. Millions are tied emotionally to Bitcoin it's important to find who satoshi is.,,,,
Whos buying?,,,,
Why are people so confident in bitcoin?,,,,
"With all the bad behavior of various of the large KYC exchanges, I'd like to point out to Europeans that Bitstamp is still operating smoothly",,,,
are you scarred,,,,
bitcoin from 2011-2013,,,,
it will open up the bandwidth for applications in the future that we haven’t even thought of. For example,,,,
paper bitcoin,,,,
right 😅,,,,
stop fucking worrying,,,,
the beauty of who bitcoin rewards,,,,
v26yp2,Hot sale: upgraded S17 and T17,2022-06-01T04:52:09.000+02:00,,
v2727f,OKMINER OS for Mining!,2022-06-01T04:57:46.000+02:00,,
v2ah85,Nostalgia-Bitcoin-Mr.Robot S2.Ep1,2022-06-01T08:30:47.000+02:00,,
v2b277,Russia's central bank says its open to using cryptocurrency for international payments as a way to counter Western sanctions,2022-06-01T09:11:02.000+02:00,,
v2b4p6,Bitcoin regains its position as a cryptocurrency after a prolonged downfall,2022-06-01T09:15:43.000+02:00,,
v2btud,Code hidden in the Bitcoin chart,2022-06-01T10:05:56.000+02:00,,
v2chhp,Sell me bitcoin?,2022-06-01T10:55:06.000+02:00,,
v2d3jo,"Bitcoin - Joe Rogan Experience #446 with Andreas Antonopoulos - January 26, 2014",2022-06-01T11:39:16.000+02:00,,
v2f9lo,"JOIN SATOSHI AND START MINING, AND EARN MONEY",2022-06-01T13:58:00.000+02:00,,
v2frsb,NIMBY Bitcoin mining ban threatens to lock New Yorkers out of the crypto revolution,2022-06-01T14:23:52.000+02:00,,
v2i6iz,Tron...good name is a good choice.,2022-06-01T16:23:45.000+02:00,,
v2kigs,Bitcoin CEO responds to the Fed with brazen cartoon,2022-06-01T18:09:40.000+02:00,,
