id,title,created_utc,body,comment_created_utc
vh2f4g,Bitcoin has not gone below its previous halvening high in the whole world. In Turkey Bitcoin is still up 368% from its 2018 high,2022-06-21T04:23:38.000+02:00,,
vh2g3r,Crypto In Plain English,2022-06-21T04:25:07.000+02:00,,
vh2hrb,Is Bitcoin doomed to be a store of value only? Hear me out…,2022-06-21T04:27:34.000+02:00,,
vh2hxq,what's it like going to a bitcoin conference??,2022-06-21T04:27:51.000+02:00,,
vh2jbg,The history of Web3,2022-06-21T04:29:59.000+02:00,,
vh2sbb,Don’t let them screw you over with your own BTC.,2022-06-21T04:43:13.000+02:00,,
vh3udg,How much Money Do You want to earn with Crypto?,2022-06-21T05:40:05.000+02:00,,
vh3wze,"MultiPlanetary $INUS starts with AAA game content and builds the inuMetaverse. Attributes included in MultiPlanetary $INUS: GameFi, P2E, MEMES,Metaverse,SocialFi, gathering and integrating the top memecoin community is the ultimate goal of MultiPlanetary $INUS.",2022-06-21T05:43:55.000+02:00,,
vh4rrg,How it feels when you invest in bitcoin.,2022-06-21T06:31:26.000+02:00,,
vh5xi1,,2022-06-21T07:39:15.000+02:00,,
vh6p8b,Is Bitcoin Actually used for Anything?,2022-06-21T08:29:07.000+02:00,,
vh74ls,What is happening here?,2022-06-21T08:57:37.000+02:00,,
vh77zp,January 2008 - Ron Paul on sound money.,2022-06-21T09:03:35.000+02:00,,
vh79d1,"Bitcoin holds near $20,000 as investors fear “domino effect”",2022-06-21T09:06:10.000+02:00,,
vh7hkp,WAGMI https://ko-fi.com/simpleart,2022-06-21T09:21:43.000+02:00,,
vh8bg5,https://marcogroot.com/2022/06/19/how-low-can-bitcoin-go/,2022-06-21T10:19:51.000+02:00,,
vh8bvj,Thoughts on the Cloud Mining?,2022-06-21T10:20:34.000+02:00,,
vhbdjb,CFXN world's best Crypto and Fiat Exchange ll Next Generation Exchange CFXN,2022-06-21T13:43:39.000+02:00,,
vhbfmo,,2022-06-21T13:47:20.000+02:00,,
vhdu5g,#Bitcoin is inevitable 🚀🚀🚀🚀,2022-06-21T15:51:21.000+02:00,,
vhetra,cloud mining,2022-06-21T16:37:39.000+02:00,,
vhf95z,Anyone else out of their DCA powder?,2022-06-21T16:57:24.000+02:00,,
vhfrxh,This is the way,2022-06-21T17:20:46.000+02:00,,
vhfu9a,The pace of Bank of Japan buying has accelerated further. The monthly run-rate is now double the pace of buying at 'peak Abenomics' at around 20 trillion yen of government bonds. It is the GDP-equivalent of the Fed doing 750bn of monthly QE in the US,2022-06-21T17:23:45.000+02:00,,
vhfws4,"Please help me I got scammed and I have no idea how to get the Bitcoin into my actual wallet. I know I’m stupid so please no mean comments, I’m new to this and was naïve.",2022-06-21T17:26:53.000+02:00,,
vhfyjz,Colombia just elected a new PRO Bitcoin president - Gustavo Petro,2022-06-21T17:29:08.000+02:00,,
vhg65g,,2022-06-21T17:38:48.000+02:00,,
vhg7fa,2008-2009 somebody I know scammed as many Bitcoin users possible. Today he's basically a billionaire,2022-06-21T17:40:21.000+02:00,,
vhh1gq,"Daily Bitcoin News June 20th,2022",2022-06-21T18:17:12.000+02:00,,
vhh8da,"Bitcoin / Crypto machine in Italy, first time i am seeing it… wanted share.",2022-06-21T18:25:42.000+02:00,,
vhhem1,"Crypto Signals FREE VIP LEAKS Trading | BTC Whale 💰🤑💲 https://t.me/elitecryptoleaks Predictum, russian insiders, binance killers",2022-06-21T18:33:40.000+02:00,,
vhieg0,Why did the crypto market fall so badly,2022-06-21T19:18:24.000+02:00,,
vhj6f0,How much to invest in BTC as a student? advices?,2022-06-21T19:52:42.000+02:00,,
vhjjfg,"NYDIG and Deloitte, global financial institutions and banks have been confronting a rising demand from their customers to extend their exposure to Bitcoin. Deloitte and NYDIG wants Bitcoin adoption to grow faster",2022-06-21T20:08:11.000+02:00,,
vhk8bv,"Bitcoin's Ratio of Supply on Exchanges is Now at a 2+ Year Low, Tether at 3.5+ Year High",2022-06-21T20:38:12.000+02:00,,
vhkccq,Nice,2022-06-21T20:43:05.000+02:00,,
vhkg5p,,2022-06-21T20:47:39.000+02:00,,
vhlxbu,V.1.1033.0.0.6,2022-06-21T21:52:52.000+02:00,,
vhmu1h,Let me destroy you economy ...,2022-06-21T22:32:30.000+02:00,,
vhn1t6,,2022-06-21T22:42:01.000+02:00,,
vhn85s,crypto vending machine 50+ cryptos,2022-06-21T22:49:50.000+02:00,,
vhni0r,Upgraded my fiat miner today (got a new job),2022-06-21T23:01:46.000+02:00,,
vhnr2c,"Edward Snowden on the crypto crash: ‘When the ground has cleared, things will grow again’",2022-06-21T23:13:18.000+02:00,,
vhoju4,Bitcoin and Monero. Help me understand (please).,2022-06-21T23:48:32.000+02:00,,
vhqeah,"The FED is trying to improve the current downturn in the cryptocurrency market, according to THE CEO of FTX.",2022-06-22T01:14:05.000+02:00,,
vhqvrc,Michael Saylor in conversation with Christopher Payne.,2022-06-22T01:37:53.000+02:00,,
vhrdtp,How to legally avoid paying taxes with Cryptocurrency,2022-06-22T02:03:21.000+02:00,,
vhrus6,Saylor publicly addresses his previous statement that you should “mortgage your house and buy bitcoin”.,2022-06-22T02:26:14.000+02:00,,
vhrzi9,"An excellent analogy for Terra investors and any other algorithmic stable coin. This is why I don't feel bad laughing when they lose everything. Yield has to come from somewhere, in the end it might come from you.",2022-06-22T02:32:44.000+02:00,,
vhs5bo,,2022-06-22T02:40:41.000+02:00,,
vhspmt,BITCOIN HODLERS UNITE!,2022-06-22T03:09:26.000+02:00,,
vhu5c8,Samson Mow on how you should talk about bitcoin on national TV &amp; how to make a distinction between bitcoin &amp; crytpo. I edited the 18 minute video down to 85 seconds.,2022-06-22T04:24:53.000+02:00,,
vhwanf,,2022-06-22T06:19:20.000+02:00,,
vhya9w,Installed plastic sheets to separate the hot from the cold air. Thanks for the advice from my last post!,2022-06-22T08:18:19.000+02:00,,
vhz1ru,,2022-06-22T09:06:32.000+02:00,,
vhzlzp,2021 investors trying to figure out where is the moon,2022-06-22T09:44:41.000+02:00,,
vi1n2h,Bitcoin Ticker (prototype testing),2022-06-22T12:01:10.000+02:00,,
vi2x50,Buy ✅️ Sell❌️,2022-06-22T13:23:37.000+02:00,,
vi3iwi,"I just need a magical article, announcement or news that'll made $BTC go from it current price to this price, so my SHIBA, ETH and MGOD can rise too. Please o ye lord. your humble servant request",2022-06-22T13:59:21.000+02:00,,
vi3j8m,Bitcoin (BTC) Faces Resistance at 200-Week Moving Average,2022-06-22T13:59:53.000+02:00,,
vi3zmh,Blockchain isn’t as decentralized as you think: Defense agency report,2022-06-22T14:23:03.000+02:00,,
vi46vk,Bitcoin: The Perfect Machine with American HODL — What Bitcoin Did,2022-06-22T14:32:21.000+02:00,,
vi4gl5,Autozone Marine solutions always work on improving the healthcare on water to save life,2022-06-22T14:46:56.000+02:00,,
vi4jp4,Old btc wallets,2022-06-22T14:51:24.000+02:00,,
vi4q6g,Is Bitcoin going down this time?,2022-06-22T15:00:25.000+02:00,,
vi51j4,,2022-06-22T15:15:56.000+02:00,,
vi5a8i,SaylorSpace - Travel through Cosmos with Michael Saylor speaking about Bitcoin,2022-06-22T15:28:08.000+02:00,,
vi5fba,"Michael Saylor: Bitcoin's Ease of Transferability Deters Corruption at Layer 3, the Custodial Layer (short audio clip)",2022-06-22T15:35:05.000+02:00,,
vi7ep6,Crypto Derivatives exchange on Bitcoin,2022-06-22T17:07:35.000+02:00,,
vi9jvh,"\"\"\"We live in a reverse mortgage.\"\"\"",2022-06-22T18:43:37.000+02:00,,
via873,Giovanni Giorgio Buys Bitcoin (meme video),2022-06-22T19:13:28.000+02:00,,
viadmv,Why is Bitcoin the big looser of the week?,2022-06-22T19:20:21.000+02:00,,
vifho9,should i wait to invest in bitcoin?,2022-06-22T23:06:05.000+02:00,,
vigl62,Hippoinu.io Top Meme NFT Marketplace — Collaborates with Proof of Reliability to audit smart contracts — Offering Exclusive REWARDS — 2 Days Left To End Whitelist,2022-06-22T23:54:59.000+02:00,,
vigx35,Twitter Bitcoin DALL-E Image Thread,2022-06-23T00:09:11.000+02:00,,
vimj8y,Question,2022-06-23T04:49:30.000+02:00,,
vimmpy,Time to wait out another crypto winter! 🍻,2022-06-23T04:54:38.000+02:00,,
vimqyk,"\"\"\"Are you going to stay on a sinking ship or get on a lifeboat &amp; be tossed about on stormy seas?\"\"\"",2022-06-23T05:00:53.000+02:00,,
vin7ju,Decentralization? Regulation?,2022-06-23T05:25:47.000+02:00,,
viqgnv,I’ve found him hiding.,2022-06-23T08:40:10.000+02:00,,
viqil5,Hold tight... the truth bombs are coming in 3...2...1...,2022-06-23T08:43:46.000+02:00,,
viqw77,Chinese People Warn Against Bitcoin: Bitcoin Will Fall To Zero!,2022-06-23T09:09:16.000+02:00,,
vir8kj,How come Youtube still ignores the spam bot problem?,2022-06-23T09:32:28.000+02:00,,
vir8rg,How come Youtube still ignores the spam bot problem?,2022-06-23T09:32:50.000+02:00,,
vitj8m,Stack sats,2022-06-23T12:13:14.000+02:00,,
vitxsl,"please can you help me with a donation of any amount, even 1 € I am in financial difficulty, I have lost everything",2022-06-23T12:40:03.000+02:00,,
viu622,"good morning everyone, I ask the community for a hand even just one euro by trading I lost everything and soon lost my house too help me with rent thanks to all",2022-06-23T12:54:55.000+02:00,,
viu95t,,2022-06-23T13:00:16.000+02:00,,
vivlyz,Fact Check: DARPA Funded Report on Blockchain (includ. Bitcoin) Centralization,2022-06-23T14:19:27.000+02:00,,
vivs4f,The Maintenance of Wealth,2022-06-23T14:28:49.000+02:00,,
viw2lu,Industrial Money (my final post),2022-06-23T14:43:17.000+02:00,,
viw41t,My final bitcoin post,2022-06-23T14:45:19.000+02:00,,
vix1ht,They never learn,2022-06-23T15:31:49.000+02:00,,
vixl22,Coinbase to Replace Coinbase Pro &amp; Launch Advanced Trade,2022-06-23T15:59:19.000+02:00,,
viy14t,,2022-06-23T16:19:51.000+02:00,,
viz6ob,Does the receiving address change every time ?,2022-06-23T17:11:56.000+02:00,,
vj10f2,Father &amp; Son Accused of Using Bitcoin to Launder Sales of Marijuana – CryptoMode,2022-06-23T18:33:29.000+02:00,,
vj1qnr,Why do banks call when you transfer money to your bank account?,2022-06-23T19:05:28.000+02:00,,
vj29ck,A podcast app that pays you in Bitcoin for listening to podcasts (Fountain),2022-06-23T19:28:31.000+02:00,,
vj2xgp,Buying and Selling of Giftcards and cryptocurrency,2022-06-23T19:58:40.000+02:00,,
vj3snq,Will the Bitcoin market go up or down in the future?,2022-06-23T20:36:49.000+02:00,,
vj4ly9,"Saudi Oil Limited will purchase 7,002 bitcoins. Our goal for 2022-2023 is to acquire 121,044 bitcoins.",2022-06-23T21:12:40.000+02:00,,
vj4q6f,twitter and btc,2022-06-23T21:17:53.000+02:00,,
vj5p9c,First Bitcoin Experience.,2022-06-23T22:01:25.000+02:00,,
vj5rt0,just a little help please,2022-06-23T22:04:32.000+02:00,,
vj5xlc,"Any kiwis in the house? We’ve got a New Zealand bitcoiners group on telegram, who wants to join? 🥝🇳🇿",2022-06-23T22:11:33.000+02:00,,
vj6bpt,"UV Leak Detection Flashlight - SUNLONGE INTERNATIONAL CO., LIMITED",2022-06-23T22:29:07.000+02:00,,
vj6lkx,When did you buy your first whole bitcoin?,2022-06-23T22:41:22.000+02:00,,
vj724f,Whoever is still left in crypto:,2022-06-23T23:01:36.000+02:00,,
vj7jee,Physical Bitcoin in Toronto (hiding minikey under security seal,2022-06-23T23:23:09.000+02:00,,
vj7t9z,How to buy anonymously?,2022-06-23T23:35:50.000+02:00,,
vj7xq8,Everything you Need to Know about Digital Asset Ownership,2022-06-23T23:41:41.000+02:00,,
vj81d1,,2022-06-23T23:46:27.000+02:00,,
vj8hoz,,2022-06-24T00:07:21.000+02:00,,
vjauz6,"not your crypto\"\" message loud and clear. As the title says",2022-06-24T02:02:07.000+02:00,,
vjbb6h,,2022-06-24T02:25:39.000+02:00,,
vjd4ik,‘Bitcoin dead’ Google searches hit new all-time high,2022-06-24T04:00:23.000+02:00,,
vjd4zc,"soy nueva en only fans, apreciaría que me ayudarán 💖.",2022-06-24T04:01:04.000+02:00,,
vjdmyo,"\"is the whole, \"\"get your money off exchanges..\"\"\"",2022-06-24T04:27:39.000+02:00,,
vje268,NYC NFT,2022-06-24T04:49:35.000+02:00,,
vjeq9z,More BTC please,2022-06-24T05:25:38.000+02:00,,
vjfyfk,Take a drive with me and think about this,2022-06-24T06:34:20.000+02:00,,
vjgbjd,,2022-06-24T06:55:13.000+02:00,,
vjglu1,,2022-06-24T07:11:26.000+02:00,,
vjjhgl,https://static1.freebitco.in/banners/728x90-3.png https://freebitco.in/?r=11202372 THIS IS NOT A SCAM. I'm trying to gather referrals. The more I have then more we can earn. You don't have to spend anything. You get free btc hourly. Use my link please!,2022-06-24T10:21:49.000+02:00,,
vjjiew,"Crypto broker Voyager Digital lowers daily withdrawal limits to $10,000 - [NYKNYB]",2022-06-24T10:23:52.000+02:00,,
vjklr2,Elon Musk sued for $258 billion over alleged Dogecoin pyramid scheme,2022-06-24T11:42:52.000+02:00,,
vjkmse,Photographer Captures The Life Of People Living Inside ‘Coffin Cubicles’ In Hong Kong,2022-06-24T11:44:58.000+02:00,,
vjksao,Coinbase pro to shutdown,2022-06-24T11:55:45.000+02:00,,
vjktzy,Real bitcoin mining site please,2022-06-24T11:59:07.000+02:00,,
vjlgmg,,2022-06-24T12:40:10.000+02:00,,
vjlhna,"Some call them scared and stupid now, they’ll call them geniuses later.",2022-06-24T12:42:07.000+02:00,,
vjm9su,"संत रविदास जी की वाणी भारत होगा विश्व विजेता, भारत होगा विश्व का नेता। दुनिया का कार्यालय होगा, भारत मे न्यायालय होगा । तब सतयुग दर्शन आवेगा, संत राज सुख बरसायेगा । सहंस वर्ष तक सतयुग लागे, विश्व गुरु बन भारत जागे । सतयुग सिर्फ संत रामपाल जी के ज्ञान से ही आ सकता है",2022-06-24T13:29:46.000+02:00,,
vjmmpc,Is Bitcoin’s value manipulatable?,2022-06-24T13:50:30.000+02:00,,
vjmmy5,Bitcoin Privacy with Matt Odell — What Bitcoin Did,2022-06-24T13:50:53.000+02:00,,
vjn796,📣Earn by sharing your DeFi Yield farming strategies with your followers!🎉,2022-06-24T14:22:10.000+02:00,,
vjnnw0,Paper wallet transfer. Does anyone know how to get bitcoin off a paper wallet to trade or transfer? Any help is appreciated.,2022-06-24T14:47:34.000+02:00,,
vjno7g,lindo lugar para pasar en familia ...el lugar es en Paraguay,2022-06-24T14:48:03.000+02:00,,
vjoajy,Bitcoin transaction fees are hovering around 2% of mining revenue for most of June. ...not bad for a bear market!,2022-06-24T15:18:56.000+02:00,,
vjowrp,The fiat death spiral: borrowing to pay debt caused by inflation,2022-06-24T15:49:44.000+02:00,,
vjp8ua,,2022-06-24T16:05:27.000+02:00,,
vjqqr5,intraday speculation,2022-06-24T17:14:33.000+02:00,,
vjqucw,"If a highstreet store accepted bitcoin, would I need to wait 10 min for my payment to clear?",2022-06-24T17:19:05.000+02:00,,
vjr01r,Bitcoiners Do the SILLIEST Things,2022-06-24T17:26:34.000+02:00,,
vjrqz0,Invest and get paid within 24hours......,2022-06-24T18:00:41.000+02:00,,
vjs8s1,,2022-06-24T18:22:32.000+02:00,,
vjt8o7,Bitcoin Forming Inverse Head and Shoulder Pattern,2022-06-24T19:07:05.000+02:00,,
vjtd4n,Besides “awesome” is there any word that can be used in all 12 or 24 places of the seed phrase?,2022-06-24T19:12:58.000+02:00,,
vjtp49,Send 1 dollar btc pls,2022-06-24T19:27:57.000+02:00,,
vjtyu9,opinions?,2022-06-24T19:39:52.000+02:00,,
vju8hi,"If the only money used is BTC and we enter in a deflationary spiral, what will prevent poor people to starve to death ?",2022-06-24T19:51:51.000+02:00,,
vjv479,Privacy question - KYC Bitcoin,2022-06-24T20:31:15.000+02:00,,
vjv5kx,SOMMERFERIE ... udover os som har arbejde xd | !tavle,2022-06-24T20:33:06.000+02:00,,
vjwks2,"\"Laboratory Greece (2019) - Debt and economic colonization of Greece. Over 95% of the resources intended to \"\"save\"\" Greece ended up in the hands of national and international banks.\"",2022-06-24T21:39:14.000+02:00,,
vjz00c,Coinbase's New 'Travel Rule' Explained,2022-06-24T23:32:04.000+02:00,,
vk0gdy,MiningOneBitcoin.com-Mining Your Own Bitcoin,2022-06-25T00:41:23.000+02:00,,
vk0pop,Aloa,2022-06-25T00:54:27.000+02:00,,
vk7n00,maplestory,2022-06-25T07:17:28.000+02:00,,
vkb7vz,Does anyone know if you can chain lofty’s 10% Cash Back Offer With Referral Partnerships?,2022-06-25T11:21:41.000+02:00,,
vkbowb,Anyone struggling with rent or bills ?,2022-06-25T11:55:57.000+02:00,,
vkf055,"Almost $4 billion in Bitcoin miner loans coming under stress, Bloomberg says",2022-06-25T15:23:32.000+02:00,,
vkga3u,Get a $500 Bitcoin Crypto Voucher Now! Only for US People...,2022-06-25T16:31:55.000+02:00,,
vkgpol,Thoughts..,2022-06-25T16:53:15.000+02:00,,
vkinll,Get your bitcoin off of exchanges! Coinflex halts withdrawals.,2022-06-25T18:26:28.000+02:00,,
vkipk6,COMPRA Y VENTA DE CRYPTOMONEDAS PERU WHATSAAP 930+582+189,2022-06-25T18:29:09.000+02:00,,
vkiqzh,,2022-06-25T18:30:55.000+02:00,,
vkiygq,🔘 TO BECOME SUCCESSFUL YOU NEED TO DO THE FOLLOWING:—,2022-06-25T18:41:02.000+02:00,,
vkj260,Poll: Crypto Community Prefers BTC Switch to PoS than ‘Let it Die’,2022-06-25T18:46:01.000+02:00,,
vkj5er,mempool flooding,2022-06-25T18:50:09.000+02:00,,
vkjzdb,Magic Internet Money,2022-06-25T19:30:05.000+02:00,,
vklhdo,Bitcoin: Cryptopayments Energy Efficiency - Scientific Paper by Michel Khazzaka,2022-06-25T20:42:35.000+02:00,,
vkmsh1,ENTENDA AS NOVAS ESTRATÉGIAS DE QUEIMA PARA SHIBA INU BATER RECORDES!!! ...,2022-06-25T21:45:56.000+02:00,,
vkpeaa,"Bitcoin, Ethereum Technical Analysis: ETH Climbs to Over $1,200 to Start the Weekend",2022-06-25T23:53:36.000+02:00,,
vkpk5v,"20,001 shitcoins on CMC. Just 1 is ultimate",2022-06-26T00:01:40.000+02:00,,
vkqgo7,How Is Cryot Mining Worth It???,2022-06-26T00:47:00.000+02:00,,
vks0at,Free Traffic for Affiliate Marketing,2022-06-26T02:08:35.000+02:00,,
vkshyr,,2022-06-26T02:36:00.000+02:00,,
vksmmm,I finally did it. Operation One Whole Coin is now complete.,2022-06-26T02:43:21.000+02:00,,
vksv0w,New York’s Latest Bill Clamping Down On Bitcoin Mining Draws Sharp Criticism,2022-06-26T02:56:26.000+02:00,,
vktl34,,2022-06-26T03:37:52.000+02:00,,
vktmq3,Best bitcoin only podcast recommendations?,2022-06-26T03:40:29.000+02:00,,
vktt31,Help with BRD Wallet migration.,2022-06-26T03:50:49.000+02:00,,
vky4ob,What would the world look like under a Bitcoin standard?,2022-06-26T08:14:52.000+02:00,,
vkyg85,Crypto earning,2022-06-26T08:36:41.000+02:00,,
vkztiv,"☀️☀️☀️Congrats on your $30,000 partnership income of $241,890, the secret to success is perseverance and fearless drive☀️",2022-06-26T10:12:05.000+02:00,,
vkzw57,here's your opportunity,2022-06-26T10:16:59.000+02:00,,
vl0hpt,Buy derb and terpy live resin concentrate online,2022-06-26T10:59:27.000+02:00,,
vl0tuh,"\"\"\"At first I was skeptical",2022-06-26T11:22:40.000+02:00,,
vl1jng,THE WRONG ANSWER IS HAVING 0% OF YOUR WEALTH IN BITCOIN | GREG FOSS,2022-06-26T12:13:10.000+02:00,,
vl2zcx,"Just found this gem, thought you'd find it funny as well",2022-06-26T13:47:11.000+02:00,,
vl41uq,#EPNS #PUSH #POWER OF WEB 3.0,2022-06-26T14:50:41.000+02:00,,
vl5pyt,Mastercard Doubles Down on its Crypto Strategy With New Acquisition,2022-06-26T16:18:54.000+02:00,,
vl5xc2,buying bitcoin in colorado,2022-06-26T16:29:11.000+02:00,,
vl6t0i,Sobiech96,2022-06-26T17:10:38.000+02:00,,
vl7hkp,I’m available for hook up both incall and out call text me on 2149030810,2022-06-26T17:42:23.000+02:00,,
vl9v95,,2022-06-26T19:31:31.000+02:00,,
vl9vqz,Education im Bereich Finanzen,2022-06-26T19:32:11.000+02:00,,
vl9xke,,2022-06-26T19:34:34.000+02:00,,
vla1ww,Question about segwit and anyone-can-spend transactions,2022-06-26T19:40:12.000+02:00,,
vlbbha,Why Market Crashes Show the True Value of Bitcoin,2022-06-26T20:38:49.000+02:00,,
vlbemf,Biden bans Russian gold,2022-06-26T20:42:51.000+02:00,,
vlcak6,Bañeras para inmersión de equipos ASIC. Envíos a todo el mundo. www.under-oil.com,2022-06-26T21:24:18.000+02:00,,
vlcbck,Are these the 3 stages of a CRYPTO WINTER?,2022-06-26T21:25:19.000+02:00,,
vlenay,Really need help so I’m under the age of 18 and my clients all pay me in venmo how can I buy btc with venmo? Is there anyway to like send someone venmo and have them send me btc? Not talking about buying with a bank or card just talking about specifically venmo,2022-06-26T23:15:28.000+02:00,,
vlfbxp,Question about cashing out,2022-06-26T23:47:59.000+02:00,,
vlhxc9,Why My Energy Company Pays Me For Running A Bitcoin Miner At Home,2022-06-27T01:58:42.000+02:00,,
vllaby,What Causes Great Crypto Crash?,2022-06-27T04:55:51.000+02:00,,
vln2ct,,2022-06-27T06:33:49.000+02:00,,
vloo89,Bitcoin’s energy use plunges to one-year low,2022-06-27T08:12:43.000+02:00,,
vlqjgc,If you’re new to crypto and still finding it hard to do your research or trying to learn how to trade with signals. I can give you a fine line of knowledge on what it’s entails. No BS!,2022-06-27T10:20:51.000+02:00,,
vlqt6j,,2022-06-27T10:41:10.000+02:00,,
vlqxef,The Dilemma Facing Fan Jiayang and the Many Ohter Chinese American Journalists,2022-06-27T10:49:51.000+02:00,,
vlrcqh,Proof-of-stake is not objective,2022-06-27T11:18:45.000+02:00,,
vlrekj,Proof-of-stake is not objective,2022-06-27T11:22:12.000+02:00,,
vlrhm9,Bitcoin Only !!,2022-06-27T11:28:21.000+02:00,,
vls43l,I'm thinking start saving 10€ every week .Does anyone know a legit way to save money with crypto and get a passive income every week?,2022-06-27T12:11:11.000+02:00,,
vlskaz,DCA App,2022-06-27T12:40:25.000+02:00,,
vlt418,A First Look at Teleport: a CoinSwap Implementation for massively improving bitcoin privacy,2022-06-27T13:15:21.000+02:00,,
vlu319,Cum deschidem manualul unei comenzi? In Linux,2022-06-27T14:12:13.000+02:00,,
vluhjx,How to buy bitcoin without waiting,2022-06-27T14:35:18.000+02:00,,
vlwbax,,2022-06-27T16:06:17.000+02:00,,
vlwswo,"Changpeng Zhao: The word “Crypto” is misleading, call it “hard money”",2022-06-27T16:29:32.000+02:00,,
vlwtlt,,2022-06-27T16:30:19.000+02:00,,
vlwxly,SEC Chairman Gary Gensler says Bitcoin is the only cryptocurrency he would consider a “commodity” on CNBC this morning.,2022-06-27T16:35:21.000+02:00,,
vlyp7l,"\"\"\"Bitcoin Is the Only One I Am Willing To Say Commodity\"\" - Gary Gensler",2022-06-27T17:54:40.000+02:00,,
vlyr0t,Up to 4163$ in Rewards - Bitget Sign up Promo!,2022-06-27T17:56:48.000+02:00,,
vlyw7p,"\"[VIDEO] \"\"Bitcoin Is the Only One I Am Willing To Say Commodity\"\" - Gary Gensler",2022-06-27T18:02:33.000+02:00,,
vlz3im,Bitcoin &amp; Lightning Podcasting AMA with Fountain CEO Oscar Merry,2022-06-27T18:11:01.000+02:00,,
vlz71n,"Bitcoin is a commodity, which is essential for any treasury reserve asset. This allows politicians, agencies, governments, &amp; institutions to support bitcoin as a technology &amp; digital asset to grow the economy and extend property rights &amp; freedom to all.",2022-06-27T18:15:08.000+02:00,,
vlzk04,,2022-06-27T18:30:30.000+02:00,,
vm0o02,"Hello World, I created a new sub dedicated to sharing exploits to reward systems.",2022-06-27T19:17:32.000+02:00,,
vm1uxm,,2022-06-27T20:08:47.000+02:00,,
vm1xjf,Best Ultrasonic Cleaner | Portable Washing Machine,2022-06-27T20:12:06.000+02:00,,
vm22kp,The life is now,2022-06-27T20:18:18.000+02:00,,
vm4ezt,"hello, I appeal to kind sincere people who can understand me, I am from Ukraine, I was left completely without money, who can help and save a young mother with a child, I don’t ask for much, God bless you and may there always be a peaceful sky above you 🙏🏻🇺🇦 5375411408303985 - Daria",2022-06-27T21:59:56.000+02:00,,
vm6cm9,"Just started a job at a huge Bitcoin mine, AMA!",2022-06-27T23:50:26.000+02:00,,
vm88ja,Good Interview..,2022-06-28T01:12:16.000+02:00,,
vmb8ua,Cronos miner,2022-06-28T03:41:35.000+02:00,,
vmc6o9,"I forgot password of file which holds BTC . The disgusting teenager made the software , Ayas Locker for windows .",2022-06-28T04:28:44.000+02:00,,
vmdgyz,Anyone else think Bitcoin should always have a mining reward?,2022-06-28T05:37:00.000+02:00,,
vme767,What are the odds of me getting both of these fortune cookies in one meal? 🤔🤔🤔,2022-06-28T06:16:46.000+02:00,,
vmexzs,psa: bitcoin halving doesn't have an affect on the price,2022-06-28T07:00:20.000+02:00,,
vmf7lc,"\"I have been red-pilled by Bitcoin vision of the future hard-money and its excellent. I have been planning to really start to stack my savings to it but I got hesitating when someone told me about Bitcoin SV. Is that just a fraud or a real \"\"improvement\"\" by so-called real Satoshi (proof missing ofc)\"",2022-06-28T07:16:10.000+02:00,,
vmgg4j,I just found one called AleoX,2022-06-28T08:32:40.000+02:00,,
vmgll3,www.Worldvex.com use the link and get $200 immediately for sign up,2022-06-28T08:42:14.000+02:00,,
vmh5z4,Bitcoin's P2P node layer could be made stronger by upgrading to encrypted messaging between peers.,2022-06-28T09:18:30.000+02:00,,
vmhe5c,https://www.youtube.com/watch?v=WLrJMZTuVXg,2022-06-28T09:33:50.000+02:00,,
vmj2ba,Bitcoin miners sell their holdings amid crypto winter's chill,2022-06-28T11:27:56.000+02:00,,
vmjp86,"Why I can't find some platforms on CMC, is that possible?",2022-06-28T12:09:37.000+02:00,,
vmkr4f,Let’s brainstorm how Bitcoin can help people in need now that Roe v. Wade has been overturned,2022-06-28T13:14:12.000+02:00,,
vmlbpn,The Future of Web 3.0 and Metaverse | BEST Investment of 2022,2022-06-28T13:47:09.000+02:00,,
vmlorr,Central Bank of Morocco to introduce Bitcoin and crypto regulation bill,2022-06-28T14:06:52.000+02:00,,
vmm8rf,How to get free Bitcoin using Crypto tab Browser,2022-06-28T14:35:09.000+02:00,,
vmmtxm,ten thousand on the table....doubt it🤣 thoughts?,2022-06-28T15:04:29.000+02:00,,
vmngsg,BITCOIN IS ALWAYS BULLISH (LONG TERM) | MAX KEISER,2022-06-28T15:36:31.000+02:00,,
vmnk1v,What could cause bitcoin's price to drop to $8000?,2022-06-28T15:41:03.000+02:00,,
vmocw0,,2022-06-28T16:18:38.000+02:00,,
vmolq3,This guy knew about the potential of Bitcoin back in 2009!,2022-06-28T16:29:53.000+02:00,,
vmpkfi,What in your opinion will not make CBDC successful?,2022-06-28T17:12:50.000+02:00,,
vmqqc0,,2022-06-28T18:03:38.000+02:00,,
