id,title,created_utc,body,comment_created_utc
v9on2p,For you DCA investors: CashApp allows you to set up a Direct Deposit and allocate a % of your deposit to be paid in Bitcoin. Get paid in Bitcoin with 1% - 100%! NO FES!,2022-06-11T05:22:36.000+02:00,,
v9tk5m,EU Nears Closing Deal On The MiCA Regulatory Framework,2022-06-11T10:58:51.000+02:00,,
v9ttwo,Web 3.0 and the Future of Internet,2022-06-11T11:18:14.000+02:00,,
v9u3gv,Take a look at the Bitcoin Note -- Bitcoin is now tangible just like cash.,2022-06-11T11:38:52.000+02:00,,
v9u5yl,10 000+ Bitcoin seller wanted!,2022-06-11T11:44:09.000+02:00,,
v9unlg,,2022-06-11T12:19:58.000+02:00,,
v9vcu3,The Art of Cleaning Dirty Money &amp; Bitcoin,2022-06-11T13:10:46.000+02:00,,
v9vkoj,What is crypto?,2022-06-11T13:26:07.000+02:00,,
v9vsnu,Get Payed Fairly in Web3,2022-06-11T13:41:04.000+02:00,,
v9w4qp,EU Member States Could Agree on a Unified Crypto Law by the End of June | Ethereum World News,2022-06-11T14:02:10.000+02:00,,
v9zvpf,"Jack Dorsey and JAY-Z Launch Bitcoin Education Course in Brooklyn, New York. Will adequate Bitcoin Education make the Average Joe more accepting of Bitcoin and even Blockchain technology",2022-06-11T17:28:16.000+02:00,,
va0mze,The American Express network has launched the first cryptocurrency rewards credit card in the United States.,2022-06-11T18:05:03.000+02:00,,
va1ddn,"\"tfw goldbugs say \"\"gold is a bargain $2k / oz\"\" and you realize how many ounces there are\"",2022-06-11T18:40:53.000+02:00,,
va2pfg,El Salvador's Bitcoin Bretton Woods Conference,2022-06-11T19:47:52.000+02:00,,
va2q8x,"BTC is down, Gold is down,S&amp;P is done (YTD) ...inflation is flying high ....",2022-06-11T19:49:00.000+02:00,,
va2rsg,Coinbase takes away 4% back on Card,2022-06-11T19:51:09.000+02:00,,
va2s7t,Cost of energy up an average 40%,2022-06-11T19:51:43.000+02:00,,
va2sz1,On WallStreetBets,2022-06-11T19:52:44.000+02:00,,
va3a1f,Relationship between Bitcoin and other chains via bridges,2022-06-11T20:16:08.000+02:00,,
va4ydu,Book Review — Bitcoin is Venice,2022-06-11T21:41:48.000+02:00,,
va62mo,,2022-06-11T22:39:43.000+02:00,,
va6bbc,,2022-06-11T22:52:12.000+02:00,,
va71ng,Free Bitcoin?,2022-06-11T23:30:08.000+02:00,,
va7fmg,Dubai-based 'FIVE' Hotels and Resorts To Accept Crypto Payments,2022-06-11T23:50:25.000+02:00,,
va84fk,Seeing a lot of FUD lately about Celsius. I don't fully understand all the details but for the sake of balance thought I'd share this video of the CEO directly addressing recent concerns.,2022-06-12T00:26:07.000+02:00,,
va8tcx,"Pardon, help me",2022-06-12T01:03:02.000+02:00,,
vab0q8,Nothing will stop me from buying bitcoin.,2022-06-12T03:08:02.000+02:00,,
vac9oz,Help understanding depth chart. What predictions could a person reasonably make based on it?,2022-06-12T04:23:53.000+02:00,,
vacn3i,Ask me how I made all that from crypto 😳😳,2022-06-12T04:46:32.000+02:00,,
vacyxo,Government Dictates Valid Use of Power New York's Mining Ban,2022-06-12T05:06:40.000+02:00,,
vad34p,5 Tips and Tricks You Should Know Be a Successful Crypto Trader,2022-06-12T05:14:07.000+02:00,,
vae3f7,"I want to buy a Bitcoin, where is the best place to buy it and where should I keep it. I don’t know much about crypto but I see a future in Bitcoin that I don’t see in anything else.",2022-06-12T06:18:57.000+02:00,,
vaeilj,"You Shouldn't Borrow Money To Buy Bitcoin, Says Jim Cramer",2022-06-12T06:47:15.000+02:00,,
vafapj,#btc,2022-06-12T07:40:49.000+02:00,,
vahh8c,Crypto Extends Tumble Into Weekend After US Inflation Data,2022-06-12T10:22:12.000+02:00,,
vai5i8,,2022-06-12T11:12:38.000+02:00,,
vaikss,Connected to I2P and TOR,2022-06-12T11:45:01.000+02:00,,
vailg1,Namecheap accepts Bitcoin,2022-06-12T11:46:17.000+02:00,,
vaj1l0,Didn’t we see a huge dip last year around the exact same time?,2022-06-12T12:19:04.000+02:00,,
vajvcg,Bitcoin best investment ever,2022-06-12T13:19:19.000+02:00,,
validw,Why am I crying over this gif,2022-06-12T15:01:15.000+02:00,,
vam5os,Celsius ex-head of institutional lending,2022-06-12T15:37:17.000+02:00,,
vam9yf,How to buy - 5$ in bitcoin without huge fees?,2022-06-12T15:43:54.000+02:00,,
vamuy4,Welcome to the Bitcoin show,2022-06-12T16:14:48.000+02:00,,
vaozcp,My wallet in coinbase was hacked. Is there any way to recover my lossy assets?,2022-06-12T18:00:03.000+02:00,,
vaq6tl,"Currency for currency, even naughty currency is no one, not 1 for 1",2022-06-12T18:58:08.000+02:00,,
vauyz7,💵BILLETES FALSOS Y TARJETAS DE CREDITO💶,2022-06-12T22:41:42.000+02:00,,
vavmvs,Bitcoin is like LSD in 60s.,2022-06-12T23:13:06.000+02:00,,
vaw9lq,"Cryptocurrency short-term contract trading, friends get in the car and eat meat with me",2022-06-12T23:43:33.000+02:00,,
vayqwq,"Peter Schiff warns, people will sell more Bitcoin when inflation rises - The Sun Dispatch",2022-06-13T01:47:22.000+02:00,,
vb0982,Bitcoin is capped at just 2.1 quadrillion (in Satoshis) kicks in the nuts. The Fiat system though.. the nut kicking is truly infinite.,2022-06-13T03:08:06.000+02:00,,
vb0evi,"Poo Po the charts all you want but BTC is in free fall territory now until 19.5 k, I will start getting back in around then, good luck to all of you. Almost 2 years until the next halving, plenty of time to accumulate.",2022-06-13T03:16:30.000+02:00,,
vb0fdt,GUH,2022-06-13T03:17:19.000+02:00,,
vb0i4r,,2022-06-13T03:21:31.000+02:00,,
vb0sxp,Come and Take It Coin,2022-06-13T03:37:47.000+02:00,,
vb0znk,Get ready to load up lads,2022-06-13T03:48:11.000+02:00,,
vb293p,"It would take a heart of stone to read about the crypto baggies huge losses, and not laugh",2022-06-13T04:56:58.000+02:00,,
vb2qye,8 months of FUD and going,2022-06-13T05:24:19.000+02:00,,
vb2tiy,Another one,2022-06-13T05:28:28.000+02:00,,
vb376w,If only og whales would sell everything they got.,2022-06-13T05:50:23.000+02:00,,
vb4f3c,"I sold guys. Sorry, I’m out.",2022-06-13T07:03:04.000+02:00,,
vb4xd9,,2022-06-13T07:35:13.000+02:00,,
vb4yy1,"If someone call you a bagholder and tell you that bitcoin is useless virtual tulip tokens, how do you make yourself feel better?",2022-06-13T07:38:08.000+02:00,,
vb5fiw,"So I’ve been a holder of bitcoin since 2017, never sold a single one and i’m not planning to what ever your answer is, however I am having trouble reasoning given how bitcoin is behaving that’s Bitcoin is an inflation hedge. Can someone with better understanding explain.",2022-06-13T08:11:51.000+02:00,,
vb5iwb,Satoshi’s funds are moved.,2022-06-13T08:18:15.000+02:00,,
vb5k0p,"We are in a dip, or is time to deal:)",2022-06-13T08:20:21.000+02:00,,
vb5ray,Satoshi’s Funds Have Been Moved,2022-06-13T08:34:33.000+02:00,,
vb61sz,,2022-06-13T08:54:56.000+02:00,,
vb6gx7,Terra (LUNA) Crash - What Really Happened? | NFTandGameFi,2022-06-13T09:23:01.000+02:00,,
vb79qf,BTC —&gt; Buy The Crash,2022-06-13T10:20:50.000+02:00,,
vb7sou,,2022-06-13T11:01:09.000+02:00,,
vb7wxn,Bitcoin news,2022-06-13T11:09:34.000+02:00,,
vb8i3g,❤️new MEXC exchange recommenders❤️,2022-06-13T11:51:57.000+02:00,,
vb8mls,Buy low sell high?,2022-06-13T12:00:37.000+02:00,,
vb9oka,I’m buying more I see an opportunity but obviously I’m not gonna throw my life savings instead I’m throwing coffee money every week and by next week I will put half of my pay in btc and eth,2022-06-13T13:10:22.000+02:00,,
vb9rso,2014: I'll wait for 100. 2018: I'll wait for 1000. 2022: I'll wait for 10000.,2022-06-13T13:15:42.000+02:00,,
vb9uka,"\"Everyone wants to be \"\"Fiat\"\"-rich",2022-06-13T13:20:28.000+02:00,,
vba9wv,It's been a little over a year since Bitcoin Law has passed in El Salvador - here's a little look at what we've seen on the ground since the start!,2022-06-13T13:45:10.000+02:00,,
vbacmg,"I’m still very new to the game, having joined the crypto world in 2017, this is only my second winter. If I’ve learnt anything over the years its that DCA is the answer, and I have a few more winters to live through yet.",2022-06-13T13:49:37.000+02:00,,
vbalzk,,2022-06-13T14:04:06.000+02:00,,
vbb1c8,How To Stake Zilliqa Crypto,2022-06-13T14:26:50.000+02:00,,
vbb6ed,"Why We Need to Advertise Crypto Projects (NFTs, Metaverses, DeFi) - Analysis of Major Challenges",2022-06-13T14:34:18.000+02:00,,
vbbng3,,2022-06-13T14:59:27.000+02:00,,
vbbwuf,Woke up in a cold sweat!,2022-06-13T15:11:56.000+02:00,,
vbc9yx,"Luxury e-tailer FarFetch accepts crypto payments, while Elon Musk's mention of DOGE on SNL causes price to plummet.",2022-06-13T15:30:33.000+02:00,,
vbcnxm,,2022-06-13T15:49:51.000+02:00,,
vbcupe,Binance pauses bitcoin withdrawals as crypto sell-off deepens,2022-06-13T15:59:17.000+02:00,,
vbdac1,Is this the best time to get into Bitcoin?,2022-06-13T16:19:16.000+02:00,,
vbdedc,Binance US Is Being Sued For Selling LUNA And UST Tokens,2022-06-13T16:24:30.000+02:00,,
vbdq04,"Friendship with Micheal Sailor has ended. Sailor Jerry spiced rum is my new best friend. $21,000 liquidation price for microstrategy",2022-06-13T16:40:07.000+02:00,,
vbdqbf,"SaylorWaves, 1 Hour of Relaxing Michael Saylor speaking about Bitcoin",2022-06-13T16:40:31.000+02:00,,
vbdryf,I just liquidated my entire BTC position. Exchanges imploding left and right. Gemini still works for now. Crypto failed.,2022-06-13T16:42:41.000+02:00,,
vbed8l,Bitcoin’s main purpose,2022-06-13T17:09:57.000+02:00,,
vbedco,Has anyone done any technical analsysis on Bitcoin and its uses?,2022-06-13T17:10:04.000+02:00,,
vbedkt,Is bitcoin crashing?,2022-06-13T17:10:19.000+02:00,,
vbem63,I’ve just joined the world of bitcoin (finally) Any advice for me?,2022-06-13T17:20:48.000+02:00,,
vbemyh,International Suicide Hotlines,2022-06-13T17:21:45.000+02:00,,
vbet4k,,2022-06-13T17:29:46.000+02:00,,
vbf3gd,Bitcoin Rules To Live By Starting Today!,2022-06-13T17:42:44.000+02:00,,
vbfo8m,"Not your key, not your coin. Right?",2022-06-13T18:08:16.000+02:00,,
vbfr22,"To anyone panicking, just sit down, take a breath, and ZOOM IN",2022-06-13T18:11:46.000+02:00,,
vbg1rq,Bittrex to Trezor,2022-06-13T18:24:55.000+02:00,,
vbg6j5,Wife: “Honey you haven’t even touched your food what’s wrong”,2022-06-13T18:30:49.000+02:00,,
vbg94o,I thought this was the ultimate safe haven asset. Have we been duped?,2022-06-13T18:34:01.000+02:00,,
vbicp2,"At a current price of $23,450, We have now fallen below bitcoin's 2017 high of $19,783 when you adjust that cycle top to compensate for inflation ($23,590)",2022-06-13T20:05:58.000+02:00,,
vbigur,when will it go below 20k? once that happens I'm taking a loan,2022-06-13T20:11:08.000+02:00,,
vbitqc,"In the 90s you would have been called crazy for investing on anything “Internet” related. They will also call you crazy now. Ignore the noise, disruptive tech can only be understood by a few, long term is generational wealth, short term is for small speculative people.",2022-06-13T20:27:36.000+02:00,,
vbj6ir,Life savings cut in half,2022-06-13T20:43:21.000+02:00,,
vbja8y,,2022-06-13T20:48:05.000+02:00,,
vbjg6j,"BITCOIN use it, don’t invest in it says, Edward Snowden",2022-06-13T20:55:35.000+02:00,,
vbji33,Hey retards. Have fun staying broke. Stop being so stupid and buy silver and gold. Have fun jumping… you know what I mean… splatttt 👍🏻,2022-06-13T20:57:57.000+02:00,,
vbjt3b,If anyone is looking for Bitcoin mining immersion services with cheap power please message me! Happy to connect and discuss.,2022-06-13T21:10:58.000+02:00,,
vbk01w,,2022-06-13T21:19:30.000+02:00,,
vbkm2l,Any kind Hearts out there ? I’ve been a member of this community for a while and I never do this.,2022-06-13T21:46:26.000+02:00,,
vbkntk,Capitulation: is beginning per the volume charts :D,2022-06-13T21:48:39.000+02:00,,
vblapk,Summer sale is on!! 🥳,2022-06-13T22:16:05.000+02:00,,
vblnfk,Scam email. Anyone familiar with it?,2022-06-13T22:31:31.000+02:00,,
vbloej,how much should I invest in Bitcoin if it is my first time?,2022-06-13T22:32:44.000+02:00,,
vblqkq,Why hold when a recession is almost certainly coming?,2022-06-13T22:35:16.000+02:00,,
vbly3n,Check this one 💵💰💸,2022-06-13T22:44:26.000+02:00,,
vbmoaa,Lets focus on fundamentals. We are in early stages,2022-06-13T23:15:45.000+02:00,,
vbn93f,The Mooch speaks,2022-06-13T23:41:23.000+02:00,,
vbnktv,Hit a long time goal of mine with today’s dip. Half a billion sats to my name. Next stop 10BTC,2022-06-13T23:56:09.000+02:00,,
vbnlrx,Wow look at those crypto losses.,2022-06-13T23:57:18.000+02:00,,
vbo76e,Where else besides coinglass I can see BTC long-short ratio?,2022-06-14T00:23:41.000+02:00,,
vboizv,A little late but - 3 year anniversary of Crypto for the homeless!,2022-06-14T00:39:03.000+02:00,,
vbon2y,,2022-06-14T00:44:28.000+02:00,,
vbpsoi,Are cryptocurrencies worth buying now?,2022-06-14T01:40:35.000+02:00,,
vbq3zp,Why are BTC/ETH bleeding more than most alts?,2022-06-14T01:56:47.000+02:00,,
vbq9d6,,2022-06-14T02:04:10.000+02:00,,
vbqebw,Cryptonator is down,2022-06-14T02:11:14.000+02:00,,
vbqo5r,"\"$2.00 \"\"Temporary\"\" Inflation Fee (wsb repost)\"",2022-06-14T02:25:31.000+02:00,,
vbr5wu,"I see this sub and I see the motivational posts and as a crypto veteran I just think “yeah it still needs to go lower for me to buy” I buy when there’s no hope, no activity on cryptocurrency subs and no motivation… so yes I’m waiting patiently.",2022-06-14T02:51:50.000+02:00,,
vbs801,Necessary evil to prune out the dead weight and over-leveraged. This too shall pass.,2022-06-14T03:48:02.000+02:00,,
vbshzc,Crypto and stock market correlation debate must come to rest.,2022-06-14T04:02:37.000+02:00,,
vbsijo,Anyone need a little bit of tinkling relaxation sounds while the world falls apart? Calming AF!,2022-06-14T04:03:25.000+02:00,,
vbsnpe,Please give me advice with something to do with my parents livelihoods,2022-06-14T04:10:58.000+02:00,,
vbt0ib,"I won't say bitcoin is over, but...",2022-06-14T04:29:16.000+02:00,,
vbt3gm,Bitcoin Shorting Guide,2022-06-14T04:33:32.000+02:00,,
vbt5k3,BTC to the MAX,2022-06-14T04:36:35.000+02:00,,
vbt7yv,One good thing about the crypto crash : The POS charlatans become glaringly obvious,2022-06-14T04:40:08.000+02:00,,
vbt8te,Just bought and drag raced a new model s plaid thanks to bitcoin!,2022-06-14T04:41:21.000+02:00,,
vbtb9q,let's do it again : weeeee,2022-06-14T04:45:10.000+02:00,,
vbtmo9,Going to 5k if this trend breaks,2022-06-14T05:02:30.000+02:00,,
vbtnhe,So my question is a bit different. We move our crypto to hardware wallets - but we leave our stocks on the exchange. How is keeping the stocks on there safe but not crypto?,2022-06-14T05:03:47.000+02:00,,
vbu0v3,Why did Bitcoin drop in the past few months?,2022-06-14T05:24:13.000+02:00,,
vbugwa,BTC and Celcius game theory discussion,2022-06-14T05:49:16.000+02:00,,
vbuve3,Bitcoin Companies Start Slashing Jobs as Crypto Market Tanks,2022-06-14T06:12:05.000+02:00,,
vbvtsp,I feel nothing,2022-06-14T07:08:48.000+02:00,,
vbwg32,-HODL- this is what I’ve been training for,2022-06-14T07:47:24.000+02:00,,
vbwt4z,Every bulls reply after the 5th continuous dip this year😂,2022-06-14T08:10:30.000+02:00,,
vbxio0,Should I buy today?,2022-06-14T08:58:39.000+02:00,,
vbxqva,❤️new MEXC exchange recommenders❤️,2022-06-14T09:13:35.000+02:00,,
vbymzx,invest about crypto Dm me,2022-06-14T10:18:42.000+02:00,,
vbyu3d,"Under the guidance of my uncle, I made DEFI, and I got a good profit every day.",2022-06-14T10:33:50.000+02:00,,
vbz9qx,Why choose Celsius?,2022-06-14T11:06:20.000+02:00,,
vbznll,"Nowadays, Ethereum is the mainstream trend. Under the guidance of my uncle, I made DEFI, and I got a good profit every day.",2022-06-14T11:34:23.000+02:00,,
vbzsup,I can’t seem to find the bottom,2022-06-14T11:45:08.000+02:00,,
vc0q23,Why does price of the deflationary asset Bitcoin crash as inflation soars?And what does it mean for Bitcoin and the safety of its network - short and long term. Discuss here.,2022-06-14T12:48:40.000+02:00,,
vc0qt3,"XCAD, New Watch 2 Earn Ecosystem",2022-06-14T12:50:07.000+02:00,,
vc102v,Literal insanity,2022-06-14T13:06:00.000+02:00,,
vc20s0,Are these good instructions for getting BTC into cold wallet?,2022-06-14T14:07:24.000+02:00,,
vc24u4,Bitcoin doesn't descriminate - Why Bitcoin is an upgrade for humanity,2022-06-14T14:14:05.000+02:00,,
vc278n,Bitcoin probably falling because of UST,2022-06-14T14:17:55.000+02:00,,
vc3n1x,,2022-06-14T15:34:37.000+02:00,,
vc4ifd,I have 20k should I buy some Bitcoin right now? Maybe just like 10K? What are you guys seeing the price at in 5 years?,2022-06-14T16:17:50.000+02:00,,
vc58f4,#625th_KabirSahib_PrakatDiwas 625वां कबीर साहेब प्रकट दिवस 14 जून को काशी शहर की पवित्र भूमि पर परमेश्वर कबीर जी ज्येष्ठ मास की शुक्ल पूर्णमासी विक्रमी संवत् 1455 (सन् 1398) सोमवार सुबह सुबह ब्रह्म मुहूर्त में पूर्ण परमेश्वर कबीर/कविर्देव जी स्वयं अपने सतलोक से आकर लहरतारा तालाब में कमल के पुष्प पर,2022-06-14T16:52:14.000+02:00,,
vc5eeq,Bitcoin stems heavy losses but pessimism reigns in crypto markets,2022-06-14T16:59:43.000+02:00,,
vc5zxt,Shots fired,2022-06-14T17:25:45.000+02:00,,
vc6c56,Bitcoin was literally created as a response to the last recession. This is its first opportunity to shine as intended. all other price action is people playing with it like a casino with their emotions...,2022-06-14T17:41:09.000+02:00,,
vc6cyt,More Bitcoin lost to the ether,2022-06-14T17:42:13.000+02:00,,
vc6h9y,BTC v. Dark Pools,2022-06-14T17:47:41.000+02:00,,
vc6rn3,"China bank protest stopped by health codes turning red, depositors say",2022-06-14T18:00:36.000+02:00,,
vc82sz,"\"Another Report Confirms That Criminal Behavior Keeps \"\"Dropping as a Percentage of Overall Crypto Activity\"\"\"",2022-06-14T18:59:18.000+02:00,,
vc8ktd,Everybody all at once now.,2022-06-14T19:21:19.000+02:00,,
vc97d2,What did the US government do with confiscated bitcoin from that TikTok couple?,2022-06-14T19:48:51.000+02:00,,
vca3ak,,2022-06-14T20:28:28.000+02:00,,
vcakrn,Have fun staying broke you failures,2022-06-14T20:50:32.000+02:00,,
vcatra,YouTube Channels?,2022-06-14T21:01:18.000+02:00,,
vcavfv,Recession,2022-06-14T21:03:23.000+02:00,,
vcb463,11 million sats,2022-06-14T21:14:22.000+02:00,,
vcb4my,Bitcoin's RSI Indicates a Bottom but Macro Factors Remain Uncertain,2022-06-14T21:14:55.000+02:00,,
vcbd29,,2022-06-14T21:25:32.000+02:00,,
vcbix0,What would you do if Bitcoin's long term trend reverses?,2022-06-14T21:33:00.000+02:00,,
vcbmoo,The Bitcoin price touches its linear regression line today,2022-06-14T21:37:50.000+02:00,,
vcbmvy,a hard wallet and a cold wallet are not the same thing:,2022-06-14T21:38:07.000+02:00,,
vcbojz,Dragon Drawing https://youtu.be/JtNGfXq-vUc,2022-06-14T21:40:13.000+02:00,,
vccm6g,If Bitcoin is like a cat it still has 3 lives ahead,2022-06-14T22:21:44.000+02:00,,
vcd57c,,2022-06-14T22:45:11.000+02:00,,
vcdugc,PSA: Notice that we are a community bragging to one another about how much we've SAVED. That's completely counter to the prevailing consumerist culture.,2022-06-14T23:16:38.000+02:00,,
vcdvyy,Buy or die,2022-06-14T23:18:34.000+02:00,,
vcee7z,,2022-06-14T23:43:01.000+02:00,,
vceedq,,2022-06-14T23:43:14.000+02:00,,
vcequ4,zero fee spot and future exchange WOO. best for times like this to earn more btc in bear market!!,2022-06-15T00:00:13.000+02:00,,
vcerwx,take a break from bitcoin and politics,2022-06-15T00:01:24.000+02:00,,
vcgdi9,i don't know why i'm writing this but i will do it any way.,2022-06-15T01:21:54.000+02:00,,
vcims7,Hi it's me again. I have *another* 99 sats for you.,2022-06-15T03:17:22.000+02:00,,
vck6za,,2022-06-15T04:40:00.000+02:00,,
vck7e0,Finally Set Up My Hardware Wallet,2022-06-15T04:40:36.000+02:00,,
vckbb3,Hey Guys. Create Amazing Bitcoin memes using the link below,2022-06-15T04:46:25.000+02:00,,
vckheu,"Bill Gates blasts cryptocurrencies, NFTs as based on 'greater-fool' theory",2022-06-15T04:55:38.000+02:00,,
vckzif,"BTC is powerful… saw this at my local coffee shop today, let’s stick it to the bankers!!",2022-06-15T05:22:25.000+02:00,,
vcloxw,Bitcoin Halving Multiple (Research),2022-06-15T06:02:23.000+02:00,,
vcm802,"Oooof…. I never thought I’d get the chance to buy at below $15,000. I think I might get my chance. I may be a whole coiner one day after all.",2022-06-15T06:33:31.000+02:00,,
vcms2n,,2022-06-15T07:07:40.000+02:00,,
vcodph,Bitcoin is a defensive asset),2022-06-15T08:51:51.000+02:00,,
vcopmu,"Might sound inappropriate, but re-iterating my 300k-400k price target in early 2023 for a third time.",2022-06-15T09:14:10.000+02:00,,
vcox5q,"Mayer Multiple 0,53 The average Mayer Multiple since the creation of Bitcoin is 1,40. The Mayer Multiple has historically been higher than today's value 98% of the time.",2022-06-15T09:28:51.000+02:00,,
vcp8bv,BnbMintOfficial,2022-06-15T09:50:56.000+02:00,,
vcp8x2,,2022-06-15T09:52:15.000+02:00,,
vcpkma,Sell your bitcoin before its to late!,2022-06-15T10:15:58.000+02:00,,
vcpwsg,bitcoin BTCUSD will go up for a while. will post next update before any sign of opposite trend,2022-06-15T10:41:01.000+02:00,,
vcpylm,People need to shut up about others only being in it for the money.,2022-06-15T10:44:51.000+02:00,,
vcq5zs,"Bitcoin loses over 5%, dips below $21,000",2022-06-15T11:00:12.000+02:00,,
vcr0gu,Can someone help me understand?,2022-06-15T12:01:30.000+02:00,,
vcr6hy,The perfect setup for crypto traders.,2022-06-15T12:13:12.000+02:00,,
vcrr3m,hey why is btc falling so hard? whats the reason and should i hodl it?,2022-06-15T12:51:49.000+02:00,,
vcru4j,The real question is….,2022-06-15T12:57:33.000+02:00,,
vcs1z3,"MSTR, BLOCK, TESLA and El Salvador holdings. All well in losses and (I hope for them) not selling",2022-06-15T13:10:39.000+02:00,,
vcsxj1,How I feel right now,2022-06-15T14:04:01.000+02:00,,
vct0vd,Now trading at US$ 21075.10 Where will it close tonight 🤔,2022-06-15T14:08:59.000+02:00,,
vctgrr,My Bitcoin Bear Market Price Prediction!,2022-06-15T14:32:51.000+02:00,,
vcu4e1,Bitcoin atomic swap volume on Atomex has reached $48 million,2022-06-15T15:07:09.000+02:00,,
vcu95c,This will end badly…,2022-06-15T15:13:42.000+02:00,,
vcv097,How's this not a Ponzi scheme right now?,2022-06-15T15:51:16.000+02:00,,
vcv1fk,,2022-06-15T15:52:54.000+02:00,,
vcvbw7,Smart Contract/Bitcoin Project/Start-up Ideas - Simple or Complex ideas,2022-06-15T16:06:48.000+02:00,,
vcvi6k,Is a coinjoin useless to hide traces? How can one spend the coins after coinjoin?,2022-06-15T16:15:15.000+02:00,,
vcvxz1,"I made a tutorial/walkthrough for the Blockstream Jade Wallet. TLDW: Price point is great, device is solid, but a few annoying bugs remain. With those fixed it will be a good deal.",2022-06-15T16:35:25.000+02:00,,
vcw035,Hey bitcoin idiots. Have fun staying poor you fucking retard cult followers. You deserve this. You deserve all of this.,2022-06-15T16:38:12.000+02:00,,
vcw63n,Hey bitcoin idiots. Get on your knees and suck my dick. Broke losers. It’s a jumping month. Can’t wait to hear about it on the news hahaha that’s what you get!,2022-06-15T16:46:10.000+02:00,,
vcxrcg,,2022-06-15T17:57:49.000+02:00,,
vcxs3f,Trader Peter Brandt expects Bitcoin to be worth around 13k. What do you think?,2022-06-15T17:58:46.000+02:00,,
vcz8q2,Bitcoin dip shits. You were wrong… admit it. Or will your cult not let you admit it?,2022-06-15T19:02:37.000+02:00,,
vczbzf,OpenSea NFT Bidding Bot,2022-06-15T19:06:38.000+02:00,,
vczcat,"Best thing about Bitcoin is how you can re-use old posts, and they're still 100% accurate.",2022-06-15T19:07:01.000+02:00,,
vczhiw,Jeff Booth x Voltage - Bitcoin &amp; Lightning Discussion Twitter Space,2022-06-15T19:13:25.000+02:00,,
vczy3t,,2022-06-15T19:33:46.000+02:00,,
vd08dw,thanks to everyone those sent for me 😊❤️❤️❤️❤️,2022-06-15T19:45:37.000+02:00,,
vd0h4h,want to know what I bought today?,2022-06-15T19:56:13.000+02:00,,
vd0rjn,The Brilliance Of Satoshi Nakamoto’s Anonymity,2022-06-15T20:08:37.000+02:00,,
vd1380,My comedy sketch,2022-06-15T20:22:50.000+02:00,,
vd16pl,Market Wrap: Crypto market has changed its momentum from Bullish To Bearish Sentiment as now bearish as bitcoin touches $20100 lows on Tuesday it is the lowest level since Dec 2020,2022-06-15T20:27:05.000+02:00,,
vd1lc5,Why Is BTC So Obviously Correlated With the S&amp;P500? (this spike followed by a drop 1h ago is so coordinated),2022-06-15T20:45:15.000+02:00,,
vd280c,"Born To Die Game 🔥🔥 btdg is something different filling every gaps , it's going to be the best one in this coming bull run.... For sure 🤩 Also ........... Investors, can stake their NFTs to be used in the market place.Huge Opportunity for everyone...guys #cryptocurrencies #cryptocurrency #COVID1",2022-06-15T21:12:51.000+02:00,,
vd2hbz,Is this sub the largest echo chamber on Reddit?,2022-06-15T21:24:31.000+02:00,,
vd2ikn,Powell's body language during today's meeting,2022-06-15T21:26:00.000+02:00,,
vd35s7,staking de cardano con nami wallet.,2022-06-15T21:57:35.000+02:00,,
vd36a7,"Alright guys in case you don’t use strike, here’s my referral code which gives us both $10, no purchase needed just a quick sign up. It’d really help me out! Thank you",2022-06-15T21:58:14.000+02:00,,
vd471o,,2022-06-15T22:44:07.000+02:00,,
vd4n3t,An interest rate increase is on it‘s way! (Crypto &amp; Stocks Prepare for Impact!),2022-06-15T23:03:44.000+02:00,,
vd5b1e,Why are hashrates rising?,2022-06-15T23:33:32.000+02:00,,
vd5yhp,Crypto’s and NFT’s are 100% a Fools Game Driven by Speculation Says Bill Gates,2022-06-16T00:02:52.000+02:00,,
vd696l,#crypto #walktoearn #nft#ByBit,2022-06-16T00:16:17.000+02:00,,
